United States,United States,36 - 45,Male,Freelancer,2 - 5,< 1,1,0,Windows,Edge,VS Code,"ESbuild, Vite, Next.js, TypeScript, NPM","JavaScript, TypeScript, C#","Canvas, WebGL, Local Storage",Phaser,React,Git,"Puzzle, Casual",I don't,"I create them on my own, AI tools","Affinity Photo, Affinity Designer",I use free (eg. CC) resources on the Internet,,"Myself, Friends and family",First prototype,Friends and family,"App Store, Google Play","X (formerly Twitter), Reddit","Salary (unrelated to game development), Advertisements",Salary (unrelated to game development),10,0,Neutral,,used as a tutor and brainstorming,7,,,
Poland,Poland,26 - 35,Male,Self-employed,Not applicable,3 - 5,6 - 10,11 - 20,"It depends, all of them.",Chrome,VS Code,"Gulp, Vite, Webpack, SvelteKit, TypeScript","JavaScript, TypeScript","Canvas, WebGL, WebGPU, PWA Installs, WebSocket, Service Workers, Local Storage, History","Three.js, Pixi.js, Godot",Svelte,Git,"Casual, Custom, Slots","Online forums and communities, Blogs and articles, Social media, Newsletters and mailing lists","I create them on my own, I have a designer in my team, I use free (eg. CC, Unsplash, Getty Images etc.) resources on the Internet, Procedural generation, AI tools","Krita, Blender, Affinity Photo, Affinity Designer","I have a music producer in my team, I use free (eg. CC) resources on the Internet, AI tools","Audacity, Audition, GarageBand","Myself, Our QA team",First prototype,"I publish my test versions publicly, Discord / Twitter / other socials, Forums","On our own website, Itch.io and similar, Client website","X (formerly Twitter), Bluesky, GitHub, Reddit",Salary (related to game development),Salary (related to game development),10,$51k - 100k,Neutral,,Made prototyping easier,6,Balancing between opened tools and paid tools,Not being taken seriously,
Brazil,Brazil,26 - 35,Male,Hobbyist,solo,1 - 2,0,0,Windows,Chrome,VS Code,None,JavaScript,"Canvas, WebSocket",,None,Git,"Adventure, RPG, Roguelike","Blogs and articles, Social media, Online courses and tutorials","I use free (eg. CC, Unsplash, Getty Images etc.) resources on the Internet","Inkscape, Aseprite",I create them on my own,FL Studio,Myself,First prototype,Via my community / my fanbase,"On our own website, Steam",None,Salary (unrelated to game development),Salary (unrelated to game development),0,0,Neutral,No,None,8,No,,
France,France,26 - 35,Male,Hobbyist,solo,3 - 5,1,0,Linux,Chrome,VS Code,"Vite, TypeScript, NPM",TypeScript,"Canvas, Local Storage",Pixi.js,React,Git,"Strategy, Roguelike",I don't,"I buy assets or packs via Internet / product (eg. Adobe Stock, Unity etc.)","GIMP, Aseprite",I buy assets or packs via Internet (eg. Envato),Audacity,Myself,Some other stage in development,I don’t find an audience to test my games,Steam,None,Salary (unrelated to game development),Salary (unrelated to game development),0,0,Neutral,,,10,,,
United Kingdom,United Kingdom,36 - 45,Male,Hobbyist,solo,3 - 5,0,0,MacOS,Safari,WebStorm,"Vite, TypeScript, NPM","JavaScript, TypeScript","Local Storage, History","Kontra, My own / in-house",None,Git,"RPG, Casual, Roguelike, Incremental","Online forums and communities, Blogs and articles, Social media, Newsletters and mailing lists","I create them on my own, I buy assets or packs via Internet / product (eg. Adobe Stock, Unity etc.), I use free (eg. CC, Unsplash, Getty Images etc.) resources on the Internet",,"I create them on my own, I buy assets or packs via Internet (eg. Envato), I use free (eg. CC) resources on the Internet",GarageBand,Myself,Concept phase,"Friends and family, Discord / Twitter / other socials, Forums","On our own website, Nothing published yet",None,Salary (unrelated to game development),Salary (unrelated to game development),,0,Strongly against,,everything online is worse,7,getting started!,,
Romania,Romania,18 - 25,Male,Hobbyist,solo,3 - 5,6 - 10,2 - 5,Windows,Firefox,VS Code,"Webpack, SvelteKit, Browserify, TypeScript","JavaScript, TypeScript, Python","Canvas, WebXR, Web Animations, WebSocket, Local Storage, Web Serial","Three.js, BabylonJS, Unity, Godot, My own / in-house",Svelte,Git,"Adventure, RPG, Puzzle, Casual, Shooter, Strategy, Stealth, Survival, Roguelike","Online forums and communities, Blogs and articles, Newsletters and mailing lists","I create them on my own, I use free (eg. CC, Unsplash, Getty Images etc.) resources on the Internet, Hiring contractor or a freelancer, Procedural generation, AI tools","Adobe Photoshop, Adobe Illustrator, Krita, Photopea, Aseprite, Blender","I create them on my own, I use free (eg. CC) resources on the Internet, Hiring contractor or a freelancer, AI tools","Audacity, Bfxr, Bandlab","Myself, Friends and family",Some other stage in development,"Via my community / my fanbase, Friends and family, Discord / Twitter / other socials",Itch.io and similar,"Bluesky, YouTube, GitHub, Discord, Reddit","Salary (unrelated to game development), Direct sales (paid games), Donations, DLCs",Salary (unrelated to game development),7,< $1k,Neutral,,Development has gotten easier as I am relying increasingly more often on AI models as if they were part of my team,5,,"Platform lock ins and the limited bandwidth, as you need asset streaming more and more these days",
Turkey,Turkey,18 - 25,Male,Self-employed,2 - 5,1 - 2,2 - 5,1,Windows Subsystem for Linux,Edge,VS Code,"Vite, NPM",JavaScript,,"Godot, Construct, Kaplay",None,Git,"Simulation, Casual, Strategy, Roguelike, Custom","Online forums and communities, Social media, Newsletters and mailing lists","I create them on my own, I use free (eg. CC, Unsplash, Getty Images etc.) resources on the Internet",Aseprite,I use free (eg. CC) resources on the Internet,Audacity,"Myself, Friends and family",When the game is totally finished,"Friends and family, Discord / Twitter / other socials",Through publishers,"YouTube, Discord","Salary (unrelated to game development), Advertisements, Client work",Salary (unrelated to game development),0,0,Neutral,,Not much. I tried it for ideas but it didn't work much.,8,Finding a job,"Nice and accesible engines like Godot, Unity, Unreal do not have lean web exports. If they did web game development community would grow so much. I think they have to work on that so it would be easy to make web games using those tools.",
Pakistan,Pakistan,< 18,Male,Hobbyist,solo,< 1,2 - 5,1,Windows,Chrome,VS Code,Vite,JavaScript,Canvas,Kaplay,None,None,None,I don't,"I use free (eg. CC, Unsplash, Getty Images etc.) resources on the Internet",Figma,I use free (eg. CC) resources on the Internet,None,Myself,When the game is totally finished,I don’t find an audience to test my games,Nothing published yet,None,None,None,0,0,Neutral,no,yes,5,no,to can't make a game that satisfy the heart,
Latvia,Latvia,26 - 35,Male,Hobbyist,solo,< 1,0,0,MacOS,Edge,WebStorm,"ESbuild, Vite, Rollup, TypeScript",TypeScript,"Canvas, WebGL, WebGPU",Phaser,React,Git,"Adventure, Action, Platform, RPG, Shooter, Stealth","Blogs and articles, Newsletters and mailing lists","I use free (eg. CC, Unsplash, Getty Images etc.) resources on the Internet",Krita,Not applicable,,Myself,Some other stage in development,Friends and family,On our own website,None,Salary (unrelated to game development),Salary (unrelated to game development),0,0,Neutral,No,,9,No,,
United States,Taiwan,26 - 35,Male,Hobbyist,Not applicable,3 - 5,2 - 5,2 - 5,Linux,Brave,Emacs,,"Lua, Fennel, Janet ",,Not applicable,None,Git,"Adventure, Platform, Puzzle, Casual","Blogs and articles, Social media, Newsletters and mailing lists","I create them on my own, I use free (eg. CC, Unsplash, Getty Images etc.) resources on the Internet",Aseprite,"I create them on my own, I use free (eg. CC) resources on the Internet",LMMS,"Myself, Friends and family",When the game is totally finished,Friends and family,Itch.io and similar,Reddit,Salary (unrelated to game development),Salary (unrelated to game development),0,< $1k,Neutral,,,9,,,
United States,United States,18 - 25,Prefer not to say,Hobbyist,Not applicable,< 1,,0,MacOS,Chrome,VS Code,"ESbuild, TypeScript","JavaScript, TypeScript",,Kaplay,,Git,"Platform, Puzzle",I don't,I create them on my own,GIMP,"I create them on my own, Procedural generation",ZzFX (by Frank Force),"Myself, Friends and family",Some other stage in development,Friends and family,Nothing published yet,"Instagram, YouTube",None,None,,,Strongly against,,It hasn't,,Developing a cohesive storyline,,
Slovakia,Slovakia,26 - 35,Male,Hobbyist,solo,< 1,2 - 5,1,Windows,Firefox,VS Code,"ESbuild, Vite, TypeScript, NPM, In-house tools","JavaScript, TypeScript","Canvas, WebGL, Web Audio, WebSocket, WebRTC, Local Storage",Kaplay,None,Git,"Adventure, Platform, Simulation, RPG, Casual, Party","Online forums and communities, Social media","I create them on my own, I use free (eg. CC, Unsplash, Getty Images etc.) resources on the Internet","Adobe Photoshop, Aseprite, Affinity Photo, Affinity Designer, Pyxel Edit",I use free (eg. CC) resources on the Internet,"Audacity, jsfxr, ZzFX and other Bfxr-like",Myself,Some other stage in development,"Friends and family, Discord / Twitter / other socials","On our own website, Itch.io and similar","X (formerly Twitter), Discord","Salary (unrelated to game development), Licensing fees (fixed / subscription / revenue share), Client work",Salary (unrelated to game development),0,0,Strongly against,,Being copied without effort,10,Shaders and math :),People advancing to other non web-first engines,
United States,United States,< 18,Male,Hobbyist,Not applicable,1 - 2,11 - 20,2 - 5,Windows,Chrome,VS Code,"Vite, TypeScript","JavaScript, TypeScript","WebRTC, Local Storage",Kaplay,,Git,"Action, Fighting, Casual, Roguelike",I don't,I create them on my own,Aseprite,"I create them on my own, I use free (eg. CC) resources on the Internet",jsfxr,Myself,First prototype,"Friends and family, Game development meeting groups and meetups, Discord / Twitter / other socials",Itch.io and similar,Discord,Salary (unrelated to game development),Salary (unrelated to game development),0,0,Strongly against,no,no,8,not understanding apis,getting started,nope
Argentina,Argentina,18 - 25,Male,Freelancer,2 - 5,3 - 5,2 - 5,6 - 10,Linux,Firefox,VS Code,"ESbuild, Vite, TypeScript","JavaScript, TypeScript","WebGPU, Local Storage",Kaplay,None,Git,"Adventure, Action, RPG, Fighting, Casual, Shooter","Online forums and communities, Blogs and articles, Newsletters and mailing lists",I create them on my own,Aseprite,"I buy assets or packs via Internet (eg. Envato), I use free (eg. CC) resources on the Internet",,"Myself, Our QA team, Community",Some other stage in development,"Via my community / my fanbase, Friends and family, I publish my test versions publicly","On our own website, Itch.io and similar",Discord,Salary (unrelated to game development),Donations,1,< $1k,Strongly against,No,Nonr,4,,,
Denmark,Denmark,26 - 35,Male,Hobbyist,solo,1 - 2,0,0,MacOS,Chrome,VS Code,"Vite, TypeScript",TypeScript,"Canvas, PWA Installs, Web Audio, WebSocket, Service Workers, Local Storage",Excalibur.js,React,Git,"Platform, Puzzle, Casual","Blogs and articles, Online courses and tutorials, Newsletters and mailing lists","I use free (eg. CC, Unsplash, Getty Images etc.) resources on the Internet, AI tools",Aseprite,"I create them on my own, I use free (eg. CC) resources on the Internet, AI tools",GarageBand,"Myself, Friends and family",First prototype,Friends and family,Itch.io and similar,Discord,Salary (unrelated to game development),Salary (unrelated to game development),0,0,Strongly against,,,8,,,
Germany,Germany,< 18,Male,Hobbyist,Not applicable,3 - 5,6 - 10,2 - 5,Windows,Firefox,VS Code,"Vite, SvelteKit, TypeScript, NPM","JavaScript, TypeScript","Canvas, WebGL, Web Audio, WebSocket, Local Storage",Kaplay,React,Git,"Adventure, Action, Shooter, Survival",Online forums and communities,"I create them on my own, I use free (eg. CC, Unsplash, Getty Images etc.) resources on the Internet","Aseprite, Blender","I create them on my own, I use free (eg. CC) resources on the Internet","Audacity, GarageBand, FL Studio","Myself, Community",When the game is totally finished,"Via my community / my fanbase, I publish my test versions publicly, Discord / Twitter / other socials",Itch.io and similar,Discord,None,None,,,Against,,,,,,
Tunisia,Turkey,18 - 25,Female,Freelancer,2 - 5,1 - 2,1,1,Windows,Chrome,VS Code,Vite,"JavaScript, Rust, C#, Lua",,Kaplay,,,Fighting,Conferences and events,I create them on my own,Pixelmator,Not applicable,GarageBand,Friends and family,When the game is totally finished,Recruiting agencies / tools,"On our own website, Itch.io and similar, Steam, Epic Games","X (formerly Twitter), Bluesky, TikTok, Mastodon, Facebook, Instagram, YouTube, GitHub","Salary (related to game development), Salary (unrelated to game development), Advertisements",In-App Purchases,1,< $1k,Neutral,not now,,10,yeap,,
Australia,Australia,< 18,Male,Hobbyist,solo,3 - 5,2 - 5,2 - 5,Linux,Brave,VS Code,My own,JavaScript,"Canvas, WebGPU, WebSocket, WebRTC, Local Storage",p5play,None,Git,"Puzzle, Casual, Shooter",Social media,"I create them on my own, I use free (eg. CC, Unsplash, Getty Images etc.) resources on the Internet",Pixlr,"I have a music producer in my team, I use free (eg. CC) resources on the Internet",,"Myself, Community, Friends and family",Concept phase,"Via my community / my fanbase, Friends and family, I publish my test versions publicly, Discord / Twitter / other socials, Forums",Steam,"YouTube, Discord, Reddit","Direct sales (paid games), Donations",Direct sales (paid games),9,< $1k,Strongly against,,,8,HTML5 Canvas performance,,
Malaysia,Malaysia,< 18,Male,Hobbyist,solo,3 - 5,6 - 10,2 - 5,Windows,Stack Next,VS Code,"Vite, NPM","JavaScript, Lua","WebSocket, Local Storage, Web Monetization",Kaplay,None,Git,Simulation,"Online forums and communities, Social media","I create them on my own, Not applicable",,Not applicable,,"Myself, Community, Friends and family",First prototype,"Via my community / my fanbase, Friends and family, I publish my test versions publicly, Discord / Twitter / other socials",Itch.io and similar,"X (formerly Twitter), Instagram, GitHub, Discord",None,None,0,0,Neutral,accepting crypto as a payment method only.,"code is written more efficiently, especially repetitive ones.",7,"Sometimes, lack of traction which discourages me from building games. I have not released a new game since 2022.","The rise of AI assistants that makes the barrier of entry lower, which results in more ""trash"" content out there",
United States,United States,,,Hobbyist,Not applicable,3 - 5,11 - 20,1,MacOS,Chrome,VS Code,None,JavaScript,,Kaplay,None,Git,,,I create them on my own,Sketchbook,Not applicable,GarageBand,"Myself, Friends and family",,"Friends and family, Discord / Twitter / other socials",,,,,,,Against,,,7,Moving from prototype to polish,,
Canada,Canada,18 - 25,Male,Hobbyist,solo,1 - 2,2 - 5,2 - 5,MacOS,Firefox,VS Code,"Vite, NPM","JavaScript, TypeScript","Canvas, WebGL, Local Storage",Kaplay,None,Git,"Adventure, Action, Platform, RPG, Fighting",Online forums and communities,I create them on my own,Aseprite,"I use free (eg. CC) resources on the Internet, https://sfxr.me/",https://sfxr.me/,"Myself, Friends and family",First prototype,,,"X (formerly Twitter), YouTube",None,,10,< $1k,Strongly against,,,7,,,
India,United States,18 - 25,Male,Business owner,6 - 20,3 - 5,2 - 5,2 - 5,MacOS,Chrome,VS Code,"Next.js, TypeScript, NPM, My own","JavaScript, TypeScript, C#","Canvas, WebGL, PWA Installs, Web Animations, WebSocket, WebRTC, WebAssembly","Three.js, Phaser, Unity, Godot, Cocos, Unreal, Kaplay",React,Git,"Adventure, Sports, Fighting, Casual, Shooter","Social media, Newsletters and mailing lists","I buy assets or packs via Internet / product (eg. Adobe Stock, Unity etc.), Hiring contractor or a freelancer",,"I buy assets or packs via Internet (eg. Envato), I use free (eg. CC) resources on the Internet",,Our QA team,First prototype,,,,"Client work, Crypto / NFTs",Client work,8,$11k - 20k,Strongly in favor,Cronos,,8,,,
United States,United States,56 - 65,Male,Business owner,solo,3 - 5,2 - 5,2 - 5,MacOS,Arc,VS Code,Vite,JavaScript,Canvas,"Phaser, Kaplay",Svelte,Git,"Action, Puzzle, Casual, Shooter, Strategy, Survival, Roguelike","Online forums and communities, Blogs and articles, Social media, Newsletters and mailing lists, Podcasts","I create them on my own, I buy assets or packs via Internet / product (eg. Adobe Stock, Unity etc.), I use free (eg. CC, Unsplash, Getty Images etc.) resources on the Internet, AI tools",Aseprite,"I create them on my own, I buy assets or packs via Internet (eg. Envato), I use free (eg. CC) resources on the Internet, AI tools","Audacity, Bfxr","Myself, Friends and family",Some other stage in development,"Via my community / my fanbase, Friends and family, I publish my test versions publicly, Discord / Twitter / other socials",Itch.io and similar,"X (formerly Twitter), Bluesky",Salary (unrelated to game development),Salary (unrelated to game development),10,0,Against,,,6,Time management ,,
United States,United States,< 18,Male,Hobbyist,2 - 5,< 1,0,1,Windows,Opera,VS Code,"Vite, TypeScript, NPM","JavaScript, TypeScript, Lua","Canvas, WebGL, PWA Installs, WebSocket, WebRTC, Local Storage","Godot, Kaplay",Svelte,Git,"Adventure, Fighting, Puzzle",I don't,"I have a designer in my team, I use free (eg. CC, Unsplash, Getty Images etc.) resources on the Internet","Inkscape, Libresprite","I have a music producer in my team, I use free (eg. CC) resources on the Internet",,"Myself, We don't have tests",,I don’t find an audience to test my games,Nothing published yet,Discord,None,None,0,< $1k,Neutral,,,,,,
United Kingdom,United Kingdom,36 - 45,Male,Hobbyist,solo,11 - 15,1,0,MacOS,Chrome,VS Code,None,JavaScript,"Canvas, WebGL, WebXR","Phaser, Kaplay, A-Frame",,Git,"Adventure, Action, Platform, RPG, Casual","Online forums and communities, Blogs and articles, Social media","I create them on my own, I use free (eg. CC, Unsplash, Getty Images etc.) resources on the Internet","Photopea, Sketch","I create them on my own, I use free (eg. CC) resources on the Internet",Audacity,"Myself, We don't have tests",First prototype,"Friends and family, I don’t find an audience to test my games",On our own website,"X (formerly Twitter), Facebook, Discord",Salary (unrelated to game development),Salary (unrelated to game development),0,0,Strongly against,,"I see more content creators pushing gen-AI slop instead of practicing creative effort or wise development processes or learning tools properly. I do not use AI-generated art but I could see how AI-gen code could speed up my programming although I would thoroughly test it. I have found that my chosen library, Kapay, is not strongly supported by AI.",9,"Communication, documentation and disseminating knowledge within the Kaplay community. Sometimes I wrestle with a problem but then discover that it had already been solved by another community member. I also frequently see inexperienced kids ask questions in chat that are easily found in the docs, I believe that means the docs could be better.",Framerate. And the variety of potential target platforms,Replit abandoned Kaboom in order to focus on AI. Luckily the community adopted and renamed it.
Brazil,Brazil,18 - 25,Male,Hobbyist,2 - 5,3 - 5,2 - 5,2 - 5,Windows,Chrome,VS Code,NPM,JavaScript,"Canvas, WebSocket",Kaplay,,Git,"Adventure, Platform, RPG, Puzzle, Strategy","Online forums and communities, Social media","I create them on my own, I have a designer in my team, I use free (eg. CC, Unsplash, Getty Images etc.) resources on the Internet, AI tools","Inkscape, Piskelapp",I create them on my own,Musescore,"Myself, Friends and family",First prototype,"Friends and family, Discord / Twitter / other socials","Itch.io and similar, Client website","X (formerly Twitter), GitHub, Discord",None,None,0,0,Neutral,No,Few sprite generations when my friend is busy,8,,,
United States,United States,18 - 25,Male,Hobbyist,solo,6 - 10,11 - 20,2 - 5,Windows,Chrome,VS Code,NPM,"JavaScript, TypeScript, C#",WebGL,"Unity, Kaplay",React,Git,"Adventure, Action, Sports, Platform, Simulation, RPG, Racing, Puzzle, Casual, Strategy, Survival, Party, Roguelike","Online courses and tutorials, Research Papers","I create them on my own, I use free (eg. CC, Unsplash, Getty Images etc.) resources on the Internet, Procedural generation","GIMP, Aseprite",I use free (eg. CC) resources on the Internet,LMMS,"Myself, Friends and family",First prototype,"Friends and family, Discord / Twitter / other socials",Nothing published yet,YouTube,Client work,Client work,1,< $1k,Neutral,No,"Tried using it to code, but never successfully got what I wanted.",8,Keeping focus on 1 singular game and not changing anything,"Lots of people for hire just using AI, instead of doing actual work.",
Canada,Italy,< 18,Male,Employed by a collective,2 - 5,1 - 2,2 - 5,1,Windows,Firefox,VS Code,"ESbuild, Vite, Webpack, Rollup, SWC, TypeScript, NPM, My own, In-house tools","JavaScript, TypeScript, Rust, C#, Lua","Canvas, WebGL, WebGPU, Web Animations, Web Audio, WebSocket, WebRTC, WebTransport, Service Workers, Local Storage, WebAssembly, History","Godot, Unreal, Kaplay, My own / in-house",None,Git,"Platform, Simulation, RPG, Casual, Shooter, Strategy, MMORPG, Stealth, Battle Royale, Survival, Roguelike, Custom","Online forums and communities, Blogs and articles, Social media","I create them on my own, I have a designer in my team, I buy assets or packs via Internet / product (eg. Adobe Stock, Unity etc.), I use free (eg. CC, Unsplash, Getty Images etc.) resources on the Internet, Procedural generation","GIMP, Aseprite, Blender, Figma, Affinity Photo, Affinity Designer","I create them on my own, I have a music producer in my team, I buy assets or packs via Internet (eg. Envato), I use free (eg. CC) resources on the Internet, Procedural generation","Audacity, FMOD, Bfxr, GarageBand","Myself, Community, Friends and family, Vitest",First prototype,"Via my community / my fanbase, Friends and family, I publish my test versions publicly, Discord / Twitter / other socials","Itch.io and similar, Through publishers, Client website","X (formerly Twitter), Mastodon, Instagram, YouTube, GitHub, Discord, Reddit",None,None,0,0,Strongly against,N/A,"Helped with autocomplete, other than that its useless",9,Ideas,ESBuild for Node for servers,N/A
United States,United States,26 - 35,Male,Business owner,solo,< 1,1,0,Windows,Brave,VS Code,Next.js,"JavaScript, TypeScript","Canvas, WebGL, WebGPU, PWA Installs, Web Animations, Web Audio, WebSocket, WebRTC, WebTransport, Local Storage, Web Monetization, History",ExcaliburJS,React,Git,"Adventure, Action, Platform, RPG","Online forums and communities, Social media","I create them on my own, I buy assets or packs via Internet / product (eg. Adobe Stock, Unity etc.), I use free (eg. CC, Unsplash, Getty Images etc.) resources on the Internet","Adobe Photoshop, Adobe Illustrator","I buy assets or packs via Internet (eg. Envato), I use free (eg. CC) resources on the Internet, AI tools",FruityLoops,"Myself, Community, Friends and family",When the game is totally finished,"Via my community / my fanbase, Friends and family, Discord / Twitter / other socials","On our own website, App Store, Google Play","X (formerly Twitter), TikTok, Facebook, Instagram, YouTube, Discord, Reddit","Advertisements, In-App Purchases, Crypto / NFTs",Advertisements,7,0,In favor,I am building an upcoming game on Solana called Mr Froggy,Love it,8,Lack of other people being willing to do what I do around me. ,"Providing unique and creative games, too many people are just remaking games. ","Give ExcaliburJS some love. Yes they don't have a sexy UI but if it wasnt for that game engine, I wouldn't be able to use AI, to pretty much code my entire project from the ground up. With all these UI based code editors, AI cant do jack yet. With ExcaliburJS and AI you can create any game you want package it up with NEXT JS and vercel now you can host and play your own game 100% free.

Next js and vercel are already changing web forever, now with gaming its a whole new level people have yet to experience when it comes to overall reduced costs to build and launch a game."
,,36 - 45,Male,Hobbyist,solo,3 - 5,1,1,MacOS,Firefox,Godot,,GDScript,Not applicable,Godot,None,Git,"Action, RPG","Online forums and communities, Podcasts, YouTube","I create them on my own, I buy assets or packs via Internet / product (eg. Adobe Stock, Unity etc.)",Aseprite,"I create them on my own, I buy assets or packs via Internet (eg. Envato)",Ableton Live,Myself,When the game is totally finished,,Itch.io and similar,,None,None,0,0,Strongly against,,,10,,,
