India,India,< 18,Male,Hobbyist,,< 1,0,0,Windows,Chrome,VS Code,,JavaScript,,,,,"Adventure, Action, Platform, RPG",I don't,I create them on my own,Ibis paint,I use free (eg. CC) resources on the Internet,,"Myself, Friends and family",When the game is totally finished,Friends and family,Itch.io and similar,,None,None,,< $1k,,,,10,3d movement mechanism ,,
Indonesia,Indonesia,26 - 35,Male,Hobbyist,solo,< 1,0,0,Windows,Opera,VS Code,TypeScript,"JavaScript, TypeScript, C#, GDScript","Canvas, WebGL","Phaser, Unity, Godot, GDevelop",None,In-house source control,"Adventure, Action, Platform, Simulation, RPG, Racing, Puzzle, Casual, Shooter, Strategy","Online forums and communities, Blogs and articles, Social media, Online courses and tutorials","I create them on my own, I use free (eg. CC, Unsplash, Getty Images etc.) resources on the Internet","GIMP, Inkscape, Krita, Aseprite, Blender, Pixelorama","I create them on my own, I use free (eg. CC) resources on the Internet","Audacity, LMMS, Bandlab, GarageBand",Myself,When the game is totally finished,"Via my community / my fanbase, Friends and family, I publish my test versions publicly, Discord / Twitter / other socials",Nothing published yet,"X (formerly Twitter), Facebook, YouTube, Reddit","Salary (unrelated to game development), Advertisements, In-App Purchases, Direct sales (paid games)",Salary (unrelated to game development),0,0,Neutral,no,I'm trying to adapt,8,My own lazyness,Woke propaganda,no
Nigeria,Nigeria,26 - 35,Male,Hobbyist,2 - 5,6 - 10,11 - 20,2 - 5,Windows,Chrome,VS Code,"ESbuild, Vite",JavaScript,Web Monetization,GDevelop,None,Git,"Adventure, Casual, Survival","Online forums and communities, Social media, Online courses and tutorials, Podcasts","I create them on my own, I have a designer in my team, I use free (eg. CC, Unsplash, Getty Images etc.) resources on the Internet","Adobe Illustrator, Photopea","I create them on my own, I have a music producer in my team, I use free (eg. CC) resources on the Internet",Audition,"Myself, Community, Friends and family",When the game is totally finished,"Via my community / my fanbase, Discord / Twitter / other socials",Itch.io and similar,"X (formerly Twitter), Facebook, Discord",Advertisements,Advertisements,10,0,Strongly in favor,Hamster coin,In this case i will say AI is a amplifier of ones ability e.g if someone skilled 3% in development with AI that skill will turn 3%x100 300%,10,Artist are expensive to hire 😭😭😭😭 ,Relationship and support ,Creating games for me is my passion I love doing it ❤️
Saudi Arabia,Saudi Arabia,< 18,Male,Hobbyist,solo,< 1,2 - 5,0,Windows,Chrome,Not a coder,None,None,Not applicable,None,None,None,"Adventure, Puzzle, Custom",I don't,"I create them on my own, I use free (eg. CC, Unsplash, Getty Images etc.) resources on the Internet",,Not applicable,,Myself,Concept phase,"Friends and family, I publish my test versions publicly",GDevelop,None,None,None,0,0,,,,10,,,
India,India,26 - 35,Male,Self-employed,2 - 5,3 - 5,6 - 10,2 - 5,Windows,Chrome,VS Code,Webpack,"JavaScript, TypeScript","Canvas, WebSocket, WebRTC, Local Storage, Web Monetization","Three.js, BabylonJS, Phaser, Pixi.js",Svelte,In-house source control,"Sports, Platform, Racing, Puzzle, Casual, Custom","Online forums and communities, Blogs and articles, Online courses and tutorials","I buy assets or packs via Internet / product (eg. Adobe Stock, Unity etc.), I use free (eg. CC, Unsplash, Getty Images etc.) resources on the Internet, Procedural generation",Inkscape,"I buy assets or packs via Internet (eg. Envato), I use free (eg. CC) resources on the Internet","Audacity, GarageBand","Myself, Friends and family",When the game is totally finished,"Via my community / my fanbase, I publish my test versions publicly","On our own website, Itch.io and similar, Through publishers, Google Play, Client website","Facebook, Instagram, GitHub","Advertisements, Direct sales (paid games), Web Monetization",Direct sales (paid games),7,$6k - 10k,Neutral,,,9,"Production phase while developing the game. The final touch ups, game state flow etc are sometimes create issues. ",AI generated gaming are a challenge in today's world for free form developers.,
France,France,36 - 45,Male,Business owner,2 - 5,3 - 5,2 - 5,6 - 10,Linux,Firefox,VS Code,"Vite, SvelteKit, TypeScript, NPM",TypeScript,"Canvas, WebGL",Pixi.js,Svelte,Git,"Strategy, Roguelike","Blogs and articles, Newsletters and mailing lists",I have a designer in my team,,Hiring contractor or a freelancer,,"Myself, Community",First prototype,"Via my community / my fanbase, Game development meeting groups and meetups, Discord / Twitter / other socials","Itch.io and similar, Steam","X (formerly Twitter), Mastodon, Instagram, YouTube, Discord, Reddit","Direct sales (paid games), State social welfare",State social welfare,1,$6k - 10k,Strongly against,No,It hasn't influenced my work.,8,,,
India,India,< 18,Male,Hobbyist,solo,1 - 2,2 - 5,2 - 5,Windows,Chrome,VS Code,Webpack,C#,WebGL,"Unity, GDevelop",React,Git,"Platform, Puzzle",Social media,"I create them on my own, I use free (eg. CC, Unsplash, Getty Images etc.) resources on the Internet","Adobe Photoshop, Blender, Ibis paint x",I use free (eg. CC) resources on the Internet,FL studio ,"Myself, Friends and family",Some other stage in development,"Friends and family, I don’t find an audience to test my games",Itch.io and similar,YouTube,None,None,0,0,Neutral,No,It's just spoil's the journey of being game dev .. like. Now I usually don't write my script I just chat gpt hense I didn't learn new things ,6,I quit very fast ,Nothing to say ,"Yea , can I get one pizza please?"
Ireland {Republic},Ireland {Republic},< 18,Male,Hobbyist,2 - 5,3 - 5,2 - 5,1,Windows,Opera,Not a coder,In-house tools,TurboWarp,Not applicable,TurboWarp,None,None,"Adventure, Casual, Survival",I don't,I create them on my own,"Krita, Aseprite",I create them on my own,"Audacity, Bandlab","Myself, Friends and family",Demo,I publish my test versions publicly,"Itch.io and similar, Google Play, Client website","Bluesky, YouTube, Reddit",Direct sales (paid games),Direct sales (paid games),4,< $1k,Strongly against,None,In no way,10,No,Publishing on Steam,No
United States,United States,26 - 35,Male,Hobbyist,solo,1 - 2,1,0,Windows,Chrome,Not a coder,In-house tools,None,Not applicable,"GDevelop, Unreal",None,In-house source control,"RPG, Casual, Custom",I don't,"I create them on my own, I use free (eg. CC, Unsplash, Getty Images etc.) resources on the Internet","Krita, Aseprite",I create them on my own,"Fl Studio, SoundTrap",Myself,When the game is totally finished,I don’t find an audience to test my games,Nothing published yet,"YouTube, Reddit",Salary (unrelated to game development),Salary (unrelated to game development),0,0,Strongly against,Absolutely not.,"It can get me out of a bind, but its a last resort.",10,Programing in JS,Advertising.,
Norway,Norway,< 18,Male,Hobbyist,2 - 5,1 - 2,6 - 10,2 - 5,Windows,OperaGx,Not a coder,,None,,"Godot, GDevelop",None,None,"Action, Platform","Social media, I don't",I create them on my own,"Blender, Microsoft Paint",I create them on my own,Beep Box,Friends and family,When the game is totally finished,Friends and family,Itch.io and similar,None,None,Salary (unrelated to game development),0,0,Against,No,Used it a very little amount,9,Testing and getting feedback,Getting it to work on itch.io,
Greece,Greece,36 - 45,Male,Business owner,2 - 5,11 - 15,6 - 10,1,MacOS,Chrome,VS Code,"My own, In-house tools, None",JavaScript,"WebGL, WebGPU, WebXR, Web Audio, WebSocket, WebRTC, Local Storage, WebAssembly, History",PlayCanvas,PlayCanvas,PlayCanvas Version Control,"Adventure, Action, Platform, Simulation, RPG, Fighting, Casual, Shooter, MMORPG, Battle Royale, Party","Online forums and communities, Blogs and articles, Social media, Conferences and events, Online courses and tutorials","I create them on my own, I buy assets or packs via Internet / product (eg. Adobe Stock, Unity etc.), Hiring contractor or a freelancer, Procedural generation","Adobe Photoshop, Blender","I buy assets or packs via Internet (eg. Envato), Hiring contractor or a freelancer",Audacity,"Myself, Our QA team, Community, Friends and family, External service, Poki Playtests",First prototype,Poki Playtests,"On our own website, Through publishers, Poki","X (formerly Twitter), TikTok, Discord","Licensing fees (fixed / subscription / revenue share), Advertisements",Advertisements,7,$51k - 100k,In favor,No,"Code generation through AI, a lot.",10,How to better understand my target audience.,"Self-publishing, in app purchases, discoverability",
Sweden,Belarus,26 - 35,Male,Business owner,2 - 5,11 - 15,11 - 20,2 - 5,MacOS,Chrome,Defold,Defold,Lua,Not applicable,Defold,None,Git,"Puzzle, Casual","Online forums and communities, Blogs and articles, Social media, Newsletters and mailing lists","I have a designer in my team, I buy assets or packs via Internet / product (eg. Adobe Stock, Unity etc.), I use free (eg. CC, Unsplash, Getty Images etc.) resources on the Internet, AI tools","Krita, Photopea, Blender, Affinity Photo, Affinity Designer","I buy assets or packs via Internet (eg. Envato), I use free (eg. CC) resources on the Internet, Hiring contractor or a freelancer",Audacity,"Myself, Community, Friends and family",First prototype,"Friends and family, Game development meeting groups and meetups","App Store, Google Play, Poki.com","X (formerly Twitter), Bluesky, Reddit","Salary (related to game development), Advertisements",Salary (related to game development),10,$100k+,Strongly against,No,Helped to speedup development without quality compromise in a few areas if use it in a smart way,10,,,
United States,United States,36 - 45,Male,Employee,6 - 20,6 - 10,6 - 10,2 - 5,Windows,Firefox,VS Code,"Vite, NPM",JavaScript,"Canvas, WebGL, WebSocket",Three.js,None,Git,"Puzzle, Casual","Online forums and communities, Social media, Online courses and tutorials","I buy assets or packs via Internet / product (eg. Adobe Stock, Unity etc.), I use free (eg. CC, Unsplash, Getty Images etc.) resources on the Internet","GIMP, Inkscape, Blender","I create them on my own, I buy assets or packs via Internet (eg. Envato), I use free (eg. CC) resources on the Internet",Audacity,"Myself, Friends and family",Some other stage in development,"Friends and family, Discord / Twitter / other socials","On our own website, Itch.io and similar","Bluesky, Mastodon",Salary (related to game development),Salary (related to game development),10,$100k+,Neutral,,"attempted an AI game jam, made a functional ugly prototype, not useful for real development",8,Getting time to finish the parts I want,Industry layoffs,
United States,Jamaica,36 - 45,Male,Hobbyist,solo,3 - 5,2 - 5,0,Windows,Chrome,Not a coder,None,GDScript,Not applicable,GDevelop,None,None,"Action, Platform, Fighting, Racing, Puzzle, Casual","Blogs and articles, Social media, Newsletters and mailing lists","I create them on my own, I use free (eg. CC, Unsplash, Getty Images etc.) resources on the Internet","Adobe Photoshop, Procreate","I create them on my own, I use free (eg. CC) resources on the Internet",Bfxr,Myself,When the game is totally finished,I don’t find an audience to test my games,"Itch.io and similar, App Store",Reddit,Salary (unrelated to game development),Salary (unrelated to game development),0,0,Neutral,,Helps brainstorm ideas for game features,7,"Making the time, focusing on one idea; Wanr a way to develop games on the go and not always sitting in front of pc. ",Getting a game noticed; monetizing ,GDevelop seems to be the only engine that allows game development on phone and tablet and desktop. Wish there were other options. 
Denmark,Denmark,< 18,Non-binary,Hobbyist,solo,6 - 10,50+,2 - 5,Linux,Arc browser for windows,In-house editor,None,JavaScript,"WebGL, Web Audio","Three.js, BabylonJS, Pixi.js, GDevelop, Kiwi.js",React,Git,"Adventure, Action, Platform, Simulation, Casual, Shooter, Survival, Roguelike, Custom","Social media, I don't",I create them on my own,"Krita, Aseprite, Blender",I create them on my own,Audacity,"Myself, Friends and family",Some other stage in development,"Via my community / my fanbase, I publish my test versions publicly, Discord / Twitter / other socials","On our own website, Itch.io and similar, gd.games","TikTok, Discord","Client work, Fiverr",Client work,0,< $1k,Strongly against,no,Cursor AI will be my best man if not husband,9,GDevelop STILL RENDERS THE FACES EVEN THO THEIR NOT VISABLE,ThreeJS being a meanie,
Germany,Germany,26 - 35,Male,Hobbyist,solo,< 1,1,0,Windows,Chrome,Not a coder,None,None,Not applicable,GDevelop,None,?,"Adventure, Action, RPG, MMORPG",Social media,"I create them on my own, AI tools",GIMP,"I use free (eg. CC) resources on the Internet, AI tools",,"Myself, Friends and family",First prototype,"Friends and family, I publish my test versions publicly, Discord / Twitter / other socials",Google Play,"TikTok, YouTube",Advertisements,Advertisements,0,0,Neutral,no ,,7,"Files that are loaded after creating the apk from the end device after starting the game are downloaded from the web . I would like to see a guide. Since you can only load 200 MB with Google Console. I would like to know how I do that, that I can load more than just the 200 ",Online service,in the resursen a size sorting would be good. so that you can see which files take up an extremely large amount of memory
United Kingdom,Sweden,46 - 55,Male,Business owner,2 - 5,15+,50+,2 - 5,MacOS,Chrome,Defold SDK,None,Lua,"WebGL, WebGPU, WebSocket, Local Storage, WebAssembly","Unity, Defold",Druid (for Defold),Git,"Action, Racing, Puzzle, Casual, Global, multiplayer collaboration game","Online forums and communities, Blogs and articles, Social media","I create them on my own, I have a designer in my team, AI tools","Adobe Photoshop, Blender, Figma","I buy assets or packs via Internet (eg. Envato), I use free (eg. CC) resources on the Internet, Hiring contractor or a freelancer",Audacity,"Myself, Community, Friends and family",First prototype,"Via my community / my fanbase, I publish my test versions publicly, Forums","On our own website, Through publishers, App Store, Google Play","X (formerly Twitter), Bluesky","Salary (related to game development), Licensing fees (fixed / subscription / revenue share), Advertisements, In-App Purchases, Client work",Salary (related to game development),8,$6k - 10k,Neutral,,It has speeded up finding information and replaced Google to the most part.,5,,Monetisation.,
France,France,36 - 45,Male,Hobbyist,solo,3 - 5,2 - 5,0,Android,Chrome,Not a coder,None,None,Web Monetization,GDevelop,None,None,"Battle Royale, Survival",Social media,"I create them on my own, AI tools","MagicaVoxel, Pixel studio",I use free (eg. CC) resources on the Internet,,"Myself, Friends and family",When the game is totally finished,"Friends and family, Discord / Twitter / other socials","Google Play, Gdgames","TikTok, Instagram, YouTube, Discord","Salary (unrelated to game development), Advertisements",Salary (unrelated to game development),10,0,Strongly against,,,9,Make it visible on playstore,,
Egypt,Egypt,< 18,Male,Hobbyist,solo,1 - 2,2 - 5,0,Android,Brave,Not a coder,None,None,Not applicable,GDevelop,None,None,"Adventure, Action, Simulation, Racing",Social media,"I create them on my own, I use free (eg. CC, Unsplash, Getty Images etc.) resources on the Internet","Canva, Flipaclip,Medibang and Ibis Paint",I use free (eg. CC) resources on the Internet,,Myself,Some other stage in development,I don’t find an audience to test my games,Itch.io and similar,"X (formerly Twitter), YouTube",None,None,0,0,Neutral,No,It has kinda helped me speed up my work but as of now the difference isnt really notable,9,Not really finding the assets I need in the internet,I don't really make web games,
United States,Mexico,< 18,Male,Hobbyist,Not applicable,3 - 5,50+,0,Windows,Opera,VS Code,None,"JavaScript, C#","Canvas, History","Three.js, Unity, GDevelop",None,None,"Platform, Simulation, RPG, Puzzle, Casual, Strategy, Survival",I don't,I create them on my own,"Canva, Krita, Aseprite","I create them on my own, I use free (eg. CC) resources on the Internet",Audacity,"Myself, Friends and family",First prototype,"Via my community / my fanbase, I publish my test versions publicly, Discord / Twitter / other socials",Itch.io and similar,"X (formerly Twitter), TikTok, YouTube","Direct sales (paid games), Donations",Direct sales (paid games),3,< $1k,Neutral,No,I dont use AI,9,Games not good enough,Unpopular (from my perspective),I'm good homie
United States,United States,< 18,Male,Solo Indie Game Developer,solo,< 1,0,0,Windows,Edge,Not a coder,None,"JavaScript, Lua",Not applicable,"Godot, Construct, GameMaker, GDevelop",None,None,"Adventure, Action, Platform, Simulation, RPG, Racing, Puzzle, Casual, Party","Online forums and communities, Blogs and articles, Social media","I create them on my own, I buy assets or packs via Internet / product (eg. Adobe Stock, Unity etc.), I use free (eg. CC, Unsplash, Getty Images etc.) resources on the Internet",Piskel,"I buy assets or packs via Internet (eg. Envato), I use free (eg. CC) resources on the Internet",,Myself,First prototype,I don’t find an audience to test my games,Itch.io and similar,None,None,None,0,0,Against,No,IDK. I don’t use AI.,9,"I really don’t know how to code, make music and sound effects, and marketing my game.",Having to draw my own thumbnails.,"I wish the easiest game engines I use like GDevelop have upgraded to fit more in the lines of Godot in terms of powerful 2D tools and exporting to gaming consoles like Nintendo, PlayStation, and Xbox."
Nepal,Nepal,18 - 25,Male,Hobbyist,solo,1 - 2,2 - 5,1,MacOS,Chrome,VS Code,"Next.js, TypeScript","JavaScript, TypeScript","Canvas, WebGL, WebGPU, Web Animations, Web Audio, Web Speech, WebRTC, WebTransport, Local Storage","Three.js, Pixi.js, Unreal",React,Git,"Puzzle, Casual, Shooter, MMORPG","Online forums and communities, Blogs and articles, Social media, Online courses and tutorials, Podcasts","I buy assets or packs via Internet / product (eg. Adobe Stock, Unity etc.), I use free (eg. CC, Unsplash, Getty Images etc.) resources on the Internet, AI tools","Adobe Photoshop, Adobe Illustrator, Figma",I use free (eg. CC) resources on the Internet,Audacity,Myself,First prototype,"Friends and family, Discord / Twitter / other socials","On our own website, Client website","Facebook, Instagram, YouTube","Salary (unrelated to game development), Donations",Salary (unrelated to game development),1,< $1k,Neutral,Not involved ,"faster game, improve player experiences, and speed up development ",6,"Balancing gameplay and fixing bugs can be tough, but it’s all part of the fun. 😁😅

","Keeping games fast and fun on all devices..

",Just that I love the challenge and creativity in game dev
United States,United States,46 - 55,Male,Freelancer,solo,15+,21 - 50,0,Windows,Firefox,VS Code,"Vite, TypeScript, NPM","JavaScript, TypeScript","Canvas, WebSocket, Local Storage","Three.js, Phaser",None,Git,"Adventure, Action, Platform, Puzzle, Casual, Shooter, Custom, Mostly games for clients; genres vary","Online forums and communities, Blogs and articles, Social media, Online courses and tutorials","I use free (eg. CC, Unsplash, Getty Images etc.) resources on the Internet, Since I'm not an artist, the graphics are mostly supplied by the clients I work with.","Inkscape, Paint.NET; Adobe Animate","I create them on my own, I use free (eg. CC) resources on the Internet, Mostly from the clients I work with.","Audacity, Wavosaur; OpenMPT / Modplug Tracker","Myself, Afer my initial testing, I then send incremental builds to my clients to test.",First prototype,"I don’t find an audience to test my games, Operating as a freelancer using B2B model, my target audience is clients looking for a game programmer, not actual games themselves.","On our own website, Client website","YouTube, GitHub, LinkedIn",Client work,Client work,10,$1k - 5k,Against,Not involved,"As long as it doesn't ""take"" my job, I've no problem with it. Otherwise, I use the free versions of Gemini and ChatGPT for coding assistance.",8,"Not when developing games, but my biggest challenge is finding quality clients.","1. Unfortunately, web game development still takes a back seat to environments driven by say, Unity or Unreal. Some developers do not consider web game development to be a ""serious"" platform.

2. As a web game developer, other non-game dev frameworks might be involved, such as React. As someone who solely uses the Canvas / WebGL (through Phaser), these tools can get in the way. While it might help, I don't think it should be strictly necessary to know web development frameworks, just to make games that run in a web browser.

3. Back-end development. As the space becomes more competitive, you'll need ways to stand out. Knowing back-end technologies (at the very least, servers, databases, user profiles/auth) are becoming more important. ",
India,India,36 - 45,Male,Freelancer,solo,6 - 10,21 - 50,6 - 10,Windows,Chrome,VS Code,Webpack,JavaScript,"Canvas, WebGL, WebGPU, WebXR, Web Animations, WebSocket, Local Storage, WebAssembly",Phaser,,,"Sports, Puzzle, Casual, Strategy, Custom","Online forums and communities, Blogs and articles, Social media, Newsletters and mailing lists, Podcasts",I create them on my own,Adobe Illustrator,I use free (eg. CC) resources on the Internet,Audacity,Myself,When the game is totally finished,I don’t find an audience to test my games,Itch.io and similar,None,Licensing fees (fixed / subscription / revenue share),Licensing fees (fixed / subscription / revenue share),3,$1k - 5k,Neutral,No,Not ,7,Being solo developer,"revenue, platform to sell game easily ",Need any websites like (fgl.com). As game developer flash era is good.
Sweden,Sweden,46 - 55,Male,Employee,21 - 50,15+,21 - 50,50+,MacOS,Chrome,VS Code,"Gulp, Vite, TypeScript, NPM, Grunt","JavaScript, TypeScript, C#","Canvas, WebGL, WebSocket, WebRTC, Local Storage, Speech Synthesis","Phaser, Pixi.js, LittleJS",None,Git,"Action, Sports, RPG, Casual, Shooter, Strategy, Roguelike","Online forums and communities, Blogs and articles","I create them on my own, I have a designer in my team, I buy assets or packs via Internet / product (eg. Adobe Stock, Unity etc.)","Adobe Photoshop, Aseprite","I create them on my own, I have a music producer in my team, I buy assets or packs via Internet (eg. Envato)","Audacity, Bfxr","Myself, Our QA team, Friends and family",First prototype,"Friends and family, Forums","On our own website, Itch.io and similar, Through publishers, Client website","Bluesky, YouTube, Discord, Reddit","Salary (related to game development), Licensing fees (fixed / subscription / revenue share), Advertisements, Client work",Salary (related to game development),8,$51k - 100k,Neutral,"GMEE, WAT",no,8,,Discoverability,
India,India,18 - 25,Male,Hobbyist,solo,< 1,0,0,Windows,Edge,None ,None,None,Not applicable,"Godot, GDevelop",None,None,"Adventure, Roguelike",I don't,"I use free (eg. CC, Unsplash, Getty Images etc.) resources on the Internet",Aseprite,I use free (eg. CC) resources on the Internet,Audacity,Not applicable,Some other stage in development,"Friends and family, Discord / Twitter / other socials",Nothing published yet,None,None,None,0,0,Neutral,No,"Scary me.  Everytime I see something cool on AI, I think about how people would have reacted happily to these under socialism.",9,Finding proper whole framework of game development. ,No Idea as i haven't try yet.,Nope
China,China,26 - 35,Male,Hobbyist,solo,< 1,1,0,Windows,Chrome,Not a coder,None,None,Not applicable,GDevelop,None,None,"Simulation, Survival",Online forums and communities,"I use free (eg. CC, Unsplash, Getty Images etc.) resources on the Internet",Affinity Designer,I use free (eg. CC) resources on the Internet,Wwise,We don't have tests,First prototype,Via my community / my fanbase,Nothing published yet,GitHub,Donations,Donations,3,< $1k,Strongly in favor,none,no,10,no,no,no
Ukraine,Ukraine,26 - 35,Male,Hobbyist,solo,3 - 5,1,2 - 5,Linux,Firefox,VS Code,Vite,"JavaScript, TypeScript","Canvas, WebGL, Local Storage, WebAssembly",Three.js,React Three Fiber,Git,"Action, Racing",Online forums and communities,"I create them on my own, I buy assets or packs via Internet / product (eg. Adobe Stock, Unity etc.), I use free (eg. CC, Unsplash, Getty Images etc.) resources on the Internet","GIMP, Krita, Aseprite, Blender, MagicaVoxel","I create them on my own, I buy assets or packs via Internet (eg. Envato), I use free (eg. CC) resources on the Internet","Audacity, LMMS",Myself,First prototype,Friends and family,Itch.io and similar,X (formerly Twitter),Salary (unrelated to game development),Salary (unrelated to game development),0,0,Neutral,,,3,,,
Sweden,Brazil,< 18,Male,Hobbyist,solo,< 1,0,0,Android,Chrome,Not a coder,"TypeScript, My own","C#, Lua",Not applicable,"Unity, Godot, GDevelop",,,"Simulation, Battle Royale",Online forums and communities,I create them on my own,,I create them on my own,LMMS,,First prototype,,"App Store, Google Play",YouTube,In-App Purchases,Client work,10,0,Strongly against,No,Chatgpt,10,Building and some codes issues,,
Italy,Italy,36 - 45,Male,Hobbyist,solo,< 1,0,0,Windows,Chrome,VS Code,None,None,Not applicable,GDevelop,None,Git,"Sports, Simulation, RPG",I don't,"I use free (eg. CC, Unsplash, Getty Images etc.) resources on the Internet",,I use free (eg. CC) resources on the Internet,,,First prototype,I don’t find an audience to test my games,Itch.io and similar,None,Salary (unrelated to game development),Salary (unrelated to game development),0,0,Strongly against,,,3,,,
