India,India,18 - 25,Male,Hobbyist,Not applicable,1 - 2,1,1,Windows,Chrome,VS Code,"ESbuild, Vite, Webpack, Next.js, NPM","JavaScript, TypeScript","Canvas, WebXR, Web Animations, Web Audio, Web Speech, WebSocket, WebRTC, WebTransport, Local Storage, Speech Synthesis, History","Three.js, W.js",React,Git,"Adventure, Platform, Casual, Custom","Online forums and communities, Blogs and articles, Social media, Online courses and tutorials, Newsletters and mailing lists, Podcasts","I create them on my own, I use free (eg. CC, Unsplash, Getty Images etc.) resources on the Internet","Adobe Photoshop, Figma","I create them on my own, I use free (eg. CC) resources on the Internet","Wwise, Audacity, GarageBand","Myself, Friends and family, External service",Some other stage in development,"Friends and family, I publish my test versions publicly, Game development meeting groups and meetups","On our own website, App Store, Google Play","Facebook, Instagram, YouTube, GitHub, Discord","In-App Purchases, Web Monetization",In-App Purchases,8,$1k - 5k,Neutral,"Yes, I am currently involved in a blockchain-based game development project. The project leverages Ethereum and Polygon chains due to their robust smart contract capabilities and scalability. We are primarily working with ERC-721 and ERC-1155 standards for NFT integration, enabling unique in-game assets like skins, weapons, and characters.  Additionally, we are exploring Solana for faster transaction speeds and lower gas fees to enhance the user experience, especially for microtransactions within the game. Our goal is to create a seamless and decentralized gaming ecosystem that empowers players to truly own, trade, and monetize their in-game assets.","The rapid growth of AI has greatly improved my work as a game developer. I use AI for procedural content generation to create game assets and levels quickly, and for enhancing NPC behavior, making characters more responsive and intelligent. AI also helps with game testing and optimization, reducing bugs and improving performance. Additionally, it allows me to deliver personalized experiences based on player behavior. Overall, AI streamlines development and enhances the quality of games.",8,"Yes, some common challenges I face include optimizing performance for different devices, debugging complex gameplay mechanics, and ensuring a smooth user experience. Balancing creative ideas with technical limitations and meeting tight deadlines can also be a struggle at times.",Performance optimization across browsers and devices. Cross-platform compatibility for seamless gameplay. Reducing latency in multiplayer experiences. Ensuring security against hacking and cheating. Adopting new technologies like WebGPU and AI efficiently.,I’m excited about the future of game development and always eager to learn and adapt to new technologies. Collaboration and continuous improvement are key to overcoming challenges and creating great gaming experiences.
United States,United States,18 - 25,Male,Hobbyist,solo,1 - 2,2 - 5,2 - 5,Windows,Firefox,Godot,,"C#, GDScript",,Godot,,,"Action, Shooter, Roguelike",Social media,I create them on my own,"Krita, Aseprite, Blender",I use free (eg. CC) resources on the Internet,,"Myself, We don't have tests",,,Itch.io and similar,None,None,None,0,0,Strongly against,,,7,,,
Russian Federation,Russian Federation,26 - 35,Female,Hobbyist,solo,1 - 2,2 - 5,1,Windows,Chrome,VS Code,In-house tools,"C#, Python, html ",Not applicable,"Renpy, Unreal 5.4 ",None,In-house source control,"VN, simulator",Online forums and communities,"I use free (eg. CC, Unsplash, Getty Images etc.) resources on the Internet, Procedural generation, AI tools","Mixamo, shedevrum","I use free (eg. CC) resources on the Internet, Procedural generation, AI tools",Audition,"Myself, External service",When the game is totally finished,"Via my community / my fanbase, I publish my test versions publicly, Discord / Twitter / other socials","Itch.io and similar, Vk play","Vk play, Twitch striming, YouTube video, rutube.ru video","Salary (related to game development), Salary (unrelated to game development), Direct sales (paid games)",Salary (unrelated to game development),3,< $1k,Neutral,No,Good,10,Yes,Dont know,No
Colombia,Venezuela,18 - 25,Male,Hobbyist,solo,< 1,0,0,Windows,Chrome,WebStorm,"Vite, Webpack","JavaScript, C#",Local Storage,"Three.js, Unreal",React,Git,None,"Online forums and communities, Social media",I create them on my own,"Krita, Aseprite, Blender","I create them on my own, I use free (eg. CC) resources on the Internet",Audacity,"Myself, We don't have tests",When the game is totally finished,I don’t find an audience to test my games,Itch.io and similar,Discord,"Salary (unrelated to game development), Crypto / NFTs",Salary (unrelated to game development),0,0,Neutral,No,It has helped with brainstorming for solutions to problems I encounter when programming,7,"I am an almost total beginner programmer and I am not good at math which game development requires knowledge of, so sometimes I struggle with finding solutions to problems that require this knowledge.",,
Canada,Canada,< 18,Male,"Currently its a hobby, but i plan to make money off my games in the future, not sure what that makes me",solo,< 1,2 - 5,0,I use android,Chrome,"I dont know what to click, i use GDevelop, which is.. coding free, apparently","I have a confession, i dont know what this means","Again, no idea","AGAIN, I DONT KNOW",GDevelop,What do these even mean ToT,????,"Whatever i feel like making, mostly automatic runners tho (i am a mobile dev, in fairness..)",I don't,I create them on my own,"I kid you not, i use IbisPaint to make graphics/sprites","I create them on my own, I use free (eg. CC) resources on the Internet, AI tools",Usually GDevelop and Suno AI are my go-to for music production,Myself,When the game is totally finished,I don’t find an audience to test my games,"On our own website, Itch.io and similar",Ive been procrastinating on it but i mean to use GameJolt for that ^~^',None,None,,,Neutral,"Nope, i dont like NFTs","Im not sure, but i think its been positive in its influence?",10,"Just the usual of things not working properly and fixing it causing other problems, nothing noteworthy",,"I am.. so sorry if my answers and lack of knowledge due to being new to game development cause issues with your studies, I am genuinely so, so sorry, I just answered honestly, even if that meant just stating that I don't know half of these things and I feel like I'll be a bit.. difficult to place in these studies, uhhh.. good luck with me, I guess, exclude me from the study if needed! -ColorfulShapes (used my game 'company' name for obvious reasons and yes I call it a company even though I'm doing everything on my own outside of unfinished collabs)"
Germany,Turkey,18 - 25,Male,Hobbyist,solo,3 - 5,2 - 5,6 - 10,Windows,Chrome,JetBrains IDE,"Vite, TypeScript","JavaScript, TypeScript, Rust","Local Storage, WebAssembly","Pixi.js, Godot, Defold",React,Git,"Adventure, RPG, Puzzle, Casual","Online forums and communities, Blogs and articles, Social media, Newsletters and mailing lists","I create them on my own, I have a designer in my team, I buy assets or packs via Internet / product (eg. Adobe Stock, Unity etc.), I use free (eg. CC, Unsplash, Getty Images etc.) resources on the Internet","Canva, Krita, Aseprite, Blender, Figma","I create them on my own, I have a music producer in my team, I buy assets or packs via Internet (eg. Envato), I use free (eg. CC) resources on the Internet","Audacity, Bfxr, Audition, Reaper",Myself,When the game is totally finished,"I publish my test versions publicly, I don’t find an audience to test my games",Itch.io and similar,None,Salary (unrelated to game development),Salary (unrelated to game development),0,0,Strongly against,,"It helps with the design phase, for putting some vague ideas and vibes into words.",5,It is a larger undertaking than it sounds and looks like. Staying committed to a project is my biggest struggle.,"AI games aren't as good as proper human made ones and they will never be. They may look decent and maybe even better than some real games to some, but they are not. Game design and development is an art form. Making money from art means sacrifices need to be made, which in turn makes for low quality games. AI games are the same; Generative AI aims for spectacle over substance because it is literally designed to do so.

Well, good luck explaining this to a random person. That's the danger.",
United States,United States,< 18,Male,Hobbyist,solo,< 1,2 - 5,2 - 5,Windows,Firefox,html?,None,JavaScript,Not applicable,rpg maker mz,rpg maker mz?,None,horror,I don't,I create them on my own,krita,I create them on my own,beep box ,Myself,First prototype,I don’t find an audience to test my games,Itch.io and similar,None,None,None,0,0,Neutral,no,no,5,Procrastinating ,Idk,
United Kingdom,United Kingdom,18 - 25,Male,Hobbyist,solo,1 - 2,2 - 5,6 - 10,Windows,Opera,VS Code,None,C#,WebGL,Unity,None,Git,"Adventure, Action, Platform, RPG, Casual, Strategy, Stealth, Roguelike",Social media,I create them on my own,"Adobe Photoshop, Inkscape, Blender",I create them on my own,"Audacity, Bandlab",Myself,When the game is totally finished,I don’t find an audience to test my games,Itch.io and similar,None,None,None,0,0,Against,No,Not,8,No,Prevalence of AI resulting in fewer jobs and lower quality end-products,
Sudan,Sudan,18 - 25,Male,Hobbyist,solo,3 - 5,2 - 5,2 - 5,Windows,Chrome,VS Code,Vite,JavaScript,"Canvas, WebGL, Web Audio","Phaser, Kaplay",None,Git,"Adventure, Action, Platform, RPG, Casual","Online forums and communities, Blogs and articles, Social media","I create them on my own, I use free (eg. CC, Unsplash, Getty Images etc.) resources on the Internet",,I use free (eg. CC) resources on the Internet,,"Myself, Friends and family",Some other stage in development,"Via my community / my fanbase, Friends and family",Itch.io and similar,Facebook,Salary (unrelated to game development),Salary (unrelated to game development),0,0,Neutral,,,8,,,
United States,United States,26 - 35,Male,Hobbyist,solo,3 - 5,2 - 5,2 - 5,Linux,Brave,VS Code,"Vite, Next.js, TypeScript","JavaScript, TypeScript, C#","WebGL, Local Storage","Unity, Godot, GameMaker, Unreal",Svelte,Git,"Adventure, Action, Platform, Simulation, RPG, Puzzle, Casual, Strategy","Online forums and communities, Social media","I create them on my own, AI tools","GIMP, Blender","I create them on my own, I use free (eg. CC) resources on the Internet",Audacity,"Myself, We don't have tests",First prototype,"Friends and family, Discord / Twitter / other socials","On our own website, Itch.io and similar","GitHub, Discord",None,None,0,0,Neutral,Bitcoin,Educational,5,Time and motivation,Motivation to finish a project ,Thank you for doing the survey.
China,China,18 - 25,Male,Hobbyist,solo,6 - 10,11 - 20,11 - 20,Windows,Edge,Visual Studio(VS) ,None,C#,WebGL,Unity,None,Plastic SCM,"Adventure, Action, Platform","Online forums and communities, Blogs and articles, Social media, Conferences and events, Online courses and tutorials","I create them on my own, I use free (eg. CC, Unsplash, Getty Images etc.) resources on the Internet",Aseprite,"I create them on my own, I use free (eg. CC) resources on the Internet",,"Myself, Our QA team, Community, Friends and family",When the game is totally finished,Friends and family,"Itch.io and similar, Through publishers","X (formerly Twitter), YouTube, Discord",None,None,0,0,Neutral,NO,It is a great help for basic code or development issues,8,"When there is almost no solution to it, you can only rely on yourself to find out when you encounter new problems or difficult attempts",How to control the size of a game and game testing and how to create graphic greatly?,"Gamedev.js Jam 2024 was the first GameJam I participated in, and although I lost that competition, I continued to try new things after that, solved one problem after another that I had never encountered before, endured many failures, and received feedback and encouragement from many people, all of which made me improve little by little! I hope to get a result that I am happy with in the Gamedev.js Jam 2025"
Nigeria,Nigeria,18 - 25,Male,Hobbyist,solo,1 - 2,2 - 5,1,Windows,Chrome,VS Code,None,"JavaScript, C++","Canvas, WebGL, WebGPU, WebXR, PWA Installs, Web Audio, Local Storage","Three.js, GameMaker, Unreal",None,Git,"Adventure, Action, Simulation, Strategy, Stealth, Survival","Online forums and communities, Blogs and articles, Social media, Conferences and events","I create them on my own, Procedural generation, AI tools","Adobe Photoshop, Blender","I create them on my own, I use free (eg. CC) resources on the Internet, Procedural generation",Bandlab,"Myself, Community, Friends and family",First prototype,"Friends and family, I publish my test versions publicly, Discord / Twitter / other socials","On our own website, Itch.io and similar, Epic Games, Google Play, Meta Horizon OS Store","X (formerly Twitter), YouTube, GitHub, Discord, Threads","Salary (unrelated to game development), Donations",Salary (unrelated to game development),10,0,Neutral,No,I've never had to make 2D background images for a while now,6,"Lack of resources and time to learn, because I'm so occupied working my day job to earn money to eat.",Monetization,
Azerbaijan,Azerbaijan,26 - 35,Male,Freelancer,2 - 5,1 - 2,1,1,"Windows, macOS ","Chrome, Yandex",VS Code,"ESbuild, Vite, Webpack, TypeScript, NPM","JavaScript, TypeScript, C#","Canvas, WebGL, Web Animations, Web Audio, Web Speech, WebSocket, Local Storage, History","Three.js, Phaser, Unity","React, react three fiber, threejs",Git,"Metroidvania, simulation ","Online forums and communities, Blogs and articles, Social media, Online courses and tutorials, Newsletters and mailing lists","I create them on my own, I have a designer in my team, I use free (eg. CC, Unsplash, Getty Images etc.) resources on the Internet, AI tools","Adobe Photoshop, Aseprite, Blender, Figma, Piskel",I use free (eg. CC) resources on the Internet,,"Myself, Friends and family, ",,,Itch.io and similar,"GitHub, Telegram",None,Salary (unrelated to game development),0,0,Neutral,,Speed,4,"Time, skill, braindance ",,
Canada,Canada,18 - 25,Male,Hobbyist,solo,< 1,2 - 5,2 - 5,Windows,Chrome,VS Code,"Webpack, Rollup, TypeScript, NPM","JavaScript, TypeScript","Canvas, WebGL, WebGPU, Web Animations, Web Audio, WebSocket, WebRTC, WebTransport, Service Workers, Local Storage","Three.js, Phaser",React,Git,"Adventure, Action, Shooter, MMORPG","Blogs and articles, Social media, Online courses and tutorials","I create them on my own, I use free (eg. CC, Unsplash, Getty Images etc.) resources on the Internet, Procedural generation",Blender,"I create them on my own, I use free (eg. CC) resources on the Internet",Audacity,Myself,When the game is totally finished,I publish my test versions publicly,Itch.io and similar,GitHub,Salary (unrelated to game development),Salary (unrelated to game development),0,0,Against,,"Pros: quick assets and code suggestions. Cons: Has AI feel, and often buggy code.",5,"As a game jam enjoyed, trying to implement the theme in a fun way.",Lack of big game companies making web games.,
Brazil,Brazil,36 - 45,Male,Hobbyist,solo,1 - 2,2 - 5,6 - 10,Windows,Chrome,Not a coder,"Next.js, Construct 3","None, Visual Event Sheet",Not applicable,"Godot, Construct",None,None,"Action, Platform, Puzzle, Shooter","Blogs and articles, Social media, Online courses and tutorials","I create them on my own, I buy assets or packs via Internet / product (eg. Adobe Stock, Unity etc.), I use free (eg. CC, Unsplash, Getty Images etc.) resources on the Internet","Clip Studio Paint, ToonBoom Harmony","I buy assets or packs via Internet (eg. Envato), I use free (eg. CC) resources on the Internet",Audacity,"Myself, Friends and family",First prototype,"Friends and family, Game development meeting groups and meetups, Discord / Twitter / other socials",Itch.io and similar,"X (formerly Twitter), YouTube",Salary (unrelated to game development),Salary (unrelated to game development),0,0,Neutral,No,"Some AI tools can help in the beggining of the project (like make place holder art for background or something similar). Even sound and music can be made using AI nowadays. But after you past the initial phase, is better to get real art and music to replace those.",6,"I'm not a full time developer. I'm actually an artist (working full time as a 2D animator)... Because of that I'm limited in knowledge regarding the programming part, that's why I mainly use Construct 3 to make small games... and since I don't have too much time to make games I'm always struggling to remember how to make some logics.","I think we have so many tools to help make games now, that all places where web games can be hosted are too crowded with clones, copies and asset flips. So, making your product stand out in the midle of so many games is a real challenge (and is probably gonna be harder in the future).",
Russian Federation,Russian Federation,26 - 35,Male,Freelancer,solo,1 - 2,2 - 5,1,"Windows, macOS ","Chrome, yandex",VS Code,"ESbuild, Vite, Webpack, TypeScript, NPM","JavaScript, TypeScript, C#","Canvas, WebGL, Web Animations, Web Audio, Web Speech, WebSocket, Service Workers, Local Storage","Three.js, Phaser, Unity","React, react three fiber",Git,"Adventure, Simulation","Online forums and communities, Blogs and articles, Social media, Online courses and tutorials, Newsletters and mailing lists","I have a designer in my team, I use free (eg. CC, Unsplash, Getty Images etc.) resources on the Internet","Adobe Photoshop, Aseprite, Figma, Piskel","I have a music producer in my team, I use free (eg. CC) resources on the Internet",Fl studio ,"Myself, Community, Friends and family, Testing libraries ",,"Via my community / my fanbase, Friends and family, I publish my test versions publicly","Itch.io and similar, Gh pages; ","YouTube, GitHub, Telegram",Salary (unrelated to game development),Salary (unrelated to game development),0,0,Neutral,Blum; ,faster information retrieval and faster learning speed,4,"I’m tired of my main job as a front-end developer and I’m already dreaming of working more with complex visuals in the browser, such as games or 2D/3D graphics",,"I accidentally filled out a form from an email address that does not exist on the itch.io website Now I updated the form and sent it with the new mail, which is on itch.io"
China,China,18 - 25,Female,Freelancer,solo,3 - 5,11 - 20,11 - 20,Windows,Chrome,VS Code,None,C#,WebGL,"Unity, Godot, Unreal",None,Git,"Platform, Puzzle, Casual, Shooter, Party, Roguelike","Online forums and communities, Blogs and articles, Social media, Conferences and events, Online courses and tutorials, Newsletters and mailing lists","I create them on my own, I have a designer in my team, I buy assets or packs via Internet / product (eg. Adobe Stock, Unity etc.), I use free (eg. CC, Unsplash, Getty Images etc.) resources on the Internet","Adobe Photoshop, Adobe Illustrator, Aseprite, Blender","I buy assets or packs via Internet (eg. Envato), I use free (eg. CC) resources on the Internet",,"Myself, Community, Friends and family",First prototype,"Via my community / my fanbase, Friends and family, I publish my test versions publicly, Game development meeting groups and meetups, Discord / Twitter / other socials","Itch.io and similar, Steam","Instagram, bilibili and xiaohongshu",Direct sales (paid games),Salary (related to game development),10,0,Neutral,no,lots of people use the same art style，ugly,9,,ai and financial matter,
India,India,18 - 25,Male,Hobbyist,2 - 5,< 1,1,0,Windows,Chrome,VS Code,None,None,Not applicable,Unreal,None,Git,"Adventure, Survival","Blogs and articles, Social media, Newsletters and mailing lists","I have a designer in my team, I use free (eg. CC, Unsplash, Getty Images etc.) resources on the Internet",Blender,I use free (eg. CC) resources on the Internet,,"Myself, Our QA team",First prototype,Friends and family,"On our own website, App Store, Google Play","X (formerly Twitter), Instagram",None,None,0,0,In favor,,,7,No,NA,
Colombia,Colombia,< 18,Male,Hobbyist,solo,6 - 10,11 - 20,2 - 5,Windows,Edge,Notepad++,My own,"JavaScript, C#, Lua, GML, Python, Vbs, C++",Canvas,"Unity, Construct, GameMaker",None,None,"Adventure, Action, Platform, RPG, Fighting, Casual, Strategy",Online forums and communities,"I have a designer in my team, I use free (eg. CC, Unsplash, Getty Images etc.) resources on the Internet",pixeleditor,AI tools,,"Myself, Friends and family",First prototype,"Friends and family, I publish my test versions publicly",Itch.io and similar,None,None,Client work,1,< $1k,Neutral,no,It has been easier for me to get music and sounds thanks to the AIs that make them,10,no,I don't know,no
Nigeria,Nigeria,26 - 35,Male,Self-employed,solo,1 - 2,0,0,Windows,Chrome,Eclipse,"ESbuild, Webpack, TypeScript",JavaScript,"Canvas, WebXR, Web Animations, Web Speech","PlayCanvas, GameMaker",Angular,Git,"Adventure, Sports, Simulation, Casual","Online forums and communities, Blogs and articles, Social media, Online courses and tutorials","I create them on my own, I buy assets or packs via Internet / product (eg. Adobe Stock, Unity etc.)","Adobe Photoshop, Canva, Sketch",I create them on my own,"Audacity, Audition","Myself, External service",Concept phase,"Via my community / my fanbase, Game development meeting groups and meetups","Itch.io and similar, Epic Games, Google Play","X (formerly Twitter), TikTok, Facebook, Instagram","Salary (related to game development), Direct sales (paid games), Web Monetization",Web Monetization,2,$1k - 5k,Strongly in favor,Tons,Greatly,10, getting graphic ,Getting support ,No
Mongolia,Mongolia,18 - 25,Male,Hobbyist,solo,3 - 5,21 - 50,2 - 5,Windows,Chrome,VS Code,"TypeScript, NPM","JavaScript, TypeScript, C#","Canvas, WebGL, Local Storage","Three.js, Unity, Godot, Cocos, Unreal",React,Git,"Adventure, Action, Platform, RPG, Fighting, Puzzle, Casual",Social media,"I create them on my own, I use free (eg. CC, Unsplash, Getty Images etc.) resources on the Internet","Aseprite, Blender, Figma",I use free (eg. CC) resources on the Internet,none,"Myself, Friends and family",First prototype,"Friends and family, Discord / Twitter / other socials","Itch.io and similar, Google Play","X (formerly Twitter), Facebook, YouTube, GitHub","Advertisements, Donations",Salary (related to game development),8,$1k - 5k,Strongly against,nope,generate assets and codes,7,nope,graphic design,nope
India,India,18 - 25,Male,Hobbyist,solo,3 - 5,6 - 10,2 - 5,Windows,Edge,VS Code,ESbuild,C#,"Canvas, WebGL, Web Animations, Web Audio, Web Speech, Service Workers, Local Storage, Web Monetization, History",Unreal,React,Git,"Adventure, Action, Sports, Platform, Simulation, RPG, Fighting, Racing, Battle Royale, Survival","Online forums and communities, Blogs and articles, Social media, Conferences and events, Online courses and tutorials, Newsletters and mailing lists, Podcasts","I buy assets or packs via Internet / product (eg. Adobe Stock, Unity etc.)",Canva,I create them on my own,"Wwise, Audacity",Myself,Some other stage in development,"Friends and family, I publish my test versions publicly, Game development meeting groups and meetups","On our own website, Itch.io and similar, Google Play","Instagram, YouTube, GitHub, Discord","Salary (unrelated to game development), Advertisements, Donations",None,5,< $1k,Neutral,NA,Not that much ,9,Packaging the game ,Run time optimization ,No 
Canada,Canada,< 18,Male,Freelancer,2 - 5,1 - 2,2 - 5,0,Windows,Chrome,VS Code,None,"JavaScript, Python & GDScript",Not applicable,Godot,None,Git,"Adventure, Action, Platform, Puzzle, Casual, Strategy, Stealth, Survival, Roguelike, Custom","Online forums and communities, Blogs and articles, Social media","I have a designer in my team, I use free (eg. CC, Unsplash, Getty Images etc.) resources on the Internet",,"I have a music producer in my team, I use free (eg. CC) resources on the Internet",,"Myself, Friends and family",Some other stage in development,"Friends and family, Discord / Twitter / other socials",Itch.io and similar,Discord,None,None,0,0,Strongly against,,,10,I run out of ideas sometimes,Geting my game out and haveing people play the.,
France,France,36 - 45,Male,Hobbyist,solo,1 - 2,2 - 5,2 - 5,Linux,Chrome,VS Code,Vite,TypeScript,,Three.js,React,Git,"Platform, Puzzle, Casual, Party",Online forums and communities,"I buy assets or packs via Internet / product (eg. Adobe Stock, Unity etc.), I use free (eg. CC, Unsplash, Getty Images etc.) resources on the Internet, AI tools",GIMP,"I buy assets or packs via Internet (eg. Envato), I use free (eg. CC) resources on the Internet",,Myself,Concept phase,I don’t find an audience to test my games,"On our own website, Rune app",,Salary (unrelated to game development),Salary (unrelated to game development),0,< $1k,Against,,,7,,,
Canada,China,36 - 45,Male,Freelancer,solo,6 - 10,21 - 50,11 - 20,Windows,Chrome,VS Code,"Vite, Next.js, TypeScript, NPM","JavaScript, TypeScript","WebGL, Local Storage","Three.js, Phaser, Pixi.js, GameMaker",React,Git,"Action, Simulation, Puzzle, Roguelike","Online forums and communities, Social media, Online courses and tutorials","I create them on my own, I buy assets or packs via Internet / product (eg. Adobe Stock, Unity etc.), I use free (eg. CC, Unsplash, Getty Images etc.) resources on the Internet, Procedural generation","Adobe Photoshop, Adobe Illustrator, GraphicsGale","I create them on my own, I buy assets or packs via Internet (eg. Envato), I use free (eg. CC) resources on the Internet",Cakewalk,Myself,Some other stage in development,Via my community / my fanbase,Itch.io and similar,"X (formerly Twitter), Bluesky, Mastodon, YouTube, Reddit",None,None,0,0,Neutral,,,8,,Lack of opportunities/open job positions since start of tech layoffs,
