Country of residence,Country of origin,Age,Gender,GameDev status,Company size,GameDev experience (in years),Games created,Game Jams entered,Operating system,Which browser are you using as your main development?,Code editor,Build tools,Programming languages,Technologies / APIs,Frameworks / engines,"Which UI library, framework, or engine wrapper are you using the most?",What source control are you using?,What genres of games do you develop?,How do you stay updated on the latest trends and advancements in web game development?,Where are you getting your graphic design assets from?,"If you create graphic design assets, what tools are you using?",Where are you getting your sound and music assets from?,"If you create sound and music assets, what tools are you using?",How do you test your code?,When is the first moment in your game development process that your target audience plays your game (family and friends not included)?,Where do you find your target audience to test your game?,Where do you publish your games?,Which platforms do you use to promote your activities?,What are your sources of income?,What is your primary source of income?,What percentage of your gamedev income does your primary source make up?,How much money are you earning from game development (yearly estimate)?,How do you feel about blockchain / crypto / NFTs coming into gamedev space?,"Are you involved in any blockchain / crypto / NFT related game development project? If so, which chain(s) / coin(s)?",How has the rapid growth of AI influenced your work as a game developer?,What's your overall happiness of what you do as a game developer (10 being the happiest)?,Are there any specific issues or struggles you're having when developing games?,"In your opinion, what are the biggest challenges facing web game development community in 2024?",Anything else you'd like to add?
Jordan,Jordan,18 - 25,Male,Self-employed,solo,6 - 10,6 - 10,2 - 5,Windows,Opera,VS Code,"Vite, Webpack, SvelteKit, TypeScript, NPM","JavaScript, TypeScript, C#","Canvas, WebGL, WebSocket, Local Storage","Three.js, Pixi.js, Unity",Svelte,Git,"Action, Simulation, Puzzle, Strategy, Survival, Party",Social media,"I create them on my own, I use free (eg. CC, Unsplash, Getty Images etc.) resources on the Internet","Adobe Photoshop, Adobe Illustrator, Inkscape, Photopea, Blender, Figma","I have a music producer in my team, I use free (eg. CC) resources on the Internet",,"Myself, Community, Friends and family",Some other stage in development,"Via my community / my fanbase, Friends and family, I publish my test versions publicly, Discord / Twitter / other socials","On our own website, Itch.io and similar, Steam, Google Play","X (formerly Twitter), Bluesky, Instagram, YouTube, GitHub, Discord","Advertisements, Client work, Donations",None,1,$1k - 5k,Neutral,,"Yes, sometimes i use to write boilerplate code to speed up development",10,Mainly art and shaping ideas before development,Users thinking web games aren't as good as games published on steam,
United States,United States,36 - 45,Male,Self-employed,solo,15+,6 - 10,6 - 10,Windows,Chrome,Notepad++,None,"JavaScript, Php","Canvas, WebGL, Web Audio, Local Storage",None,None,Git,"RPG, Puzzle, Strategy, Roguelike","Online forums and communities, Podcasts","I create them on my own, Hiring contractor or a freelancer",GIMP,I use free (eg. CC) resources on the Internet,,"Myself, Friends and family",First prototype,"Via my community / my fanbase, Friends and family","App Store, Google Play, Crazygames ","X (formerly Twitter), Reddit, Patreon","Advertisements, In-App Purchases",Advertisements,8,$51k - 100k,In favor,,Helps a little to make weird test logos and backgrounds,8,"Windows now has device screen scale set to 150% by default, which makes my pixel perfect games look bad.",Most platforms don’t rank games well. Users don’t find most games. ,
Botswana,Botswana,18 - 25,Male,Hobbyist,solo,< 1,1,0,Windows,Arc browser,VS Code,My own,"JavaScript, C#",WebGL,Three.js,None,Git,Puzzle,Social media,I create them on my own,"Inkscape, Blender, Clip Studio Paint",Not applicable,Audacity,"Myself, Friends and family",First prototype,"Friends and family, I publish my test versions publicly",Nothing published yet,GitHub,None,Salary (unrelated to game development),0,0,Strongly against,no,no,8,"getting stuck when trying figure out how to implement a feature, very frustrating",no interest from casual players to try games that are web based.,no
United States,United States,26 - 35,Male,Hobbyist,solo,< 1,0,0,Linux,Firefox,VS Code,"Vite, Next.js, TypeScript, NPM","JavaScript, TypeScript",Canvas,Excalibur.js,None,Git,"RPG, Casual, Strategy","Online forums and communities, Social media, Online courses and tutorials","I buy assets or packs via Internet / product (eg. Adobe Stock, Unity etc.), I use free (eg. CC, Unsplash, Getty Images etc.) resources on the Internet, Hiring contractor or a freelancer",Aseprite,"I buy assets or packs via Internet (eg. Envato), I use free (eg. CC) resources on the Internet",,"Myself, Friends and family, We don't have tests",Concept phase,"Via my community / my fanbase, Friends and family, I publish my test versions publicly, Discord / Twitter / other socials","On our own website, Itch.io and similar, Steam, App Store, Google Play","X (formerly Twitter), TikTok, Facebook, Instagram, YouTube, Discord",Salary (unrelated to game development),Salary (unrelated to game development),0,0,Strongly against,,,10,Funding,,
United States,United States,36 - 45,Male,Hobbyist,solo,15+,21 - 50,2 - 5,Linux,Chrome,Pluma,My own,"JavaScript, C","Canvas, WebGL, Web Audio, WebSocket, Local Storage, WebAssembly","My own / in-house, None",None,Git,"Adventure, Platform, RPG","Online forums and communities, Conferences and events, Newsletters and mailing lists",I create them on my own,GIMP,I create them on my own,Logic,"Myself, Community, Friends and family",When the game is totally finished,I don’t find an audience to test my games,"On our own website, Itch.io and similar, Steam",Discord,Salary (unrelated to game development),Salary (unrelated to game development),10,0,Strongly against,,Not at all; avoiding it,10,,,
United Kingdom,Zimbabwe,46 - 55,Male,Freelancer,solo,15+,11 - 20,6 - 10,Linux,Firefox,Vim,"NPM, ClojureScript tooling","JavaScript, ClojureScript","Canvas, WebGL, PWA Installs, Web Audio, WebSocket, WebRTC, Local Storage, History","Three.js, My own / in-house, React",React,Git,"Action, Platform, RPG, Casual, Roguelike, Cosy","Online forums and communities, Blogs and articles, Newsletters and mailing lists","I create them on my own, I have a designer in my team, I buy assets or packs via Internet / product (eg. Adobe Stock, Unity etc.), I use free (eg. CC, Unsplash, Getty Images etc.) resources on the Internet, Procedural generation, AI tools","GIMP, Inkscape","I create them on my own, I have a music producer in my team, Procedural generation","Audacity, sfxr.me, OpenMPT, Pure Data","Myself, Our QA team, Friends and family",First prototype,"Friends and family, Client team","On our own website, Itch.io and similar, Client website","X (formerly Twitter), Bluesky, Mastodon, YouTube, GitHub, Discord, Reddit","Direct sales (paid games), Client work, Investments",Investments,3,$21k - 50k,Neutral,,Tinkered with building some tools,8,Marketing,Over-engineered solutions (Unity etc.) when many 2d games can be made with simpler tools,Love gamedev.js!
United States,United States,46 - 55,Male,Hobbyist,solo,3 - 5,2 - 5,2 - 5,Windows,Chrome,VS Code,"Vite, TypeScript, NPM",TypeScript,"Canvas, PWA Installs, Web Audio, WebSocket, WebRTC, Local Storage, WebAssembly",Excalibur,None,Git,"RPG, Puzzle, Shooter, Roguelike","Online forums and communities, Blogs and articles, Social media, Online courses and tutorials, Newsletters and mailing lists, Podcasts","I create them on my own, I buy assets or packs via Internet / product (eg. Adobe Stock, Unity etc.), I use free (eg. CC, Unsplash, Getty Images etc.) resources on the Internet, Procedural generation",Aseprite,"I create them on my own, I buy assets or packs via Internet (eg. Envato), I use free (eg. CC) resources on the Internet, Procedural generation","LMMS, JSFXR","Myself, Community, Friends and family",First prototype,"Friends and family, I publish my test versions publicly, Discord / Twitter / other socials",Itch.io and similar,"Bluesky, YouTube, Discord",Salary (unrelated to game development),Salary (unrelated to game development),0,0,Strongly against,no,yes,9,Accessibility,Accessibility,
Egypt,Egypt,18 - 25,Male,Freelancer,solo,< 1,1,1,Windows,Edge,Godot,None,GDscript,Not applicable,Godot,None,None,"Adventure, Action, Platform, Puzzle, Shooter, Strategy","Online forums and communities, Social media","I create them on my own, I use free (eg. CC, Unsplash, Getty Images etc.) resources on the Internet",Aseprite,"I create them on my own, I use free (eg. CC) resources on the Internet",Audacity,"Myself, Community",Some other stage in development,"Game development meeting groups and meetups, Discord / Twitter / other socials",Itch.io and similar,Discord,None,None,3,0,Against,"No , i did not",It helps sometimes in the code but not much,7,No ,Discoverability,No thanks (=
France,France,36 - 45,Male,Hobbyist,solo,1 - 2,0,0,Windows,Chrome,VS Code,"ESbuild, Vite, Nuxt.js, TypeScript, NPM",TypeScript,"Canvas, WebGL, PWA Installs, Web Audio, WebSocket, Service Workers, Local Storage","Pixi.js, Excalibur",vue3-pixi,Git,"Strategy, Roguelike, TCG",I don't,I create them on my own,Aseprite,I create them on my own,Audacity,We don't have tests,First prototype,"Friends and family, I publish my test versions publicly, Game development meeting groups and meetups, Discord / Twitter / other socials",On our own website,Discord,Salary (unrelated to game development),Salary (unrelated to game development),0,0,Strongly against,,it hasn't,5,My games suck and I keept making another one without finishing the previous one,The public doesn't care about non-meme web games,
United States,United States,26 - 35,Male,Hobbyist,solo,11 - 15,11 - 20,11 - 20,Windows,Chrome,VS Code,"ESbuild, Vite, Webpack, Rollup, Browserify, TypeScript, NPM, In-house tools","JavaScript, TypeScript, C#, Lua","Canvas, WebGL, Web Audio, Local Storage, WebAssembly",Excalibur,Angular,Git,"Adventure, Platform, Simulation, RPG, Puzzle, Casual, Party","Online forums and communities, Blogs and articles, Social media, Online courses and tutorials, Newsletters and mailing lists, Podcasts","I create them on my own, I buy assets or packs via Internet / product (eg. Adobe Stock, Unity etc.), I use free (eg. CC, Unsplash, Getty Images etc.) resources on the Internet","Canva, GIMP, Aseprite","I create them on my own, I buy assets or packs via Internet (eg. Envato), I use free (eg. CC) resources on the Internet","Audacity, Bfxr","Myself, Friends and family",Some other stage in development,"Via my community / my fanbase, Friends and family, I publish my test versions publicly, Game development meeting groups and meetups, Discord / Twitter / other socials","On our own website, Itch.io and similar","X (formerly Twitter), Bluesky, Mastodon, Instagram, YouTube, GitHub, Discord","Salary (unrelated to game development), Client work, Donations",Salary (unrelated to game development),0,$1k - 5k,Strongly against,,"I've avoided it, I'm pretty negative on LLMs Specifically",8,,"Standing out in a large sea of competition, and porting to consoles like Switch/XBOX/PSN",
Brazil,Brazil,26 - 35,Male,Hobbyist,solo,3 - 5,0,2 - 5,Linux,Firefox,VS Code,"ESbuild, SWC, NPM",JavaScript,"Canvas, WebRTC, Local Storage","Phaser, GDevelop, My own / in-house",None,Git,Casual,"Online forums and communities, Blogs and articles, Newsletters and mailing lists","I create them on my own, I buy assets or packs via Internet / product (eg. Adobe Stock, Unity etc.), I use free (eg. CC, Unsplash, Getty Images etc.) resources on the Internet",Inkscape,I use free (eg. CC) resources on the Internet,,"Myself, Friends and family",First prototype,Friends and family,Itch.io and similar,None,Salary (unrelated to game development),Salary (unrelated to game development),0,< $1k,Against,,,6,,,
Italy,Italy,36 - 45,Male,Hobbyist,solo,< 1,2 - 5,1,Linux,Firefox,VS Code,Vite,JavaScript,"PWA Installs, Web Animations, Web Audio, WebSocket, Local Storage, Speech Synthesis","My own / in-house, None",None,Git,"Adventure, Puzzle, Custom",I don't,"I create them on my own, I have a designer in my team",Inkscape,"I create them on my own, AI tools",,We don't have tests,First prototype,Friends and family,Nothing published yet,None,Salary (unrelated to game development),Salary (unrelated to game development),1,0,Strongly against,,,7,,,
United Kingdom,United Kingdom,66+,Male,Business owner,2 - 5,15+,50+,2 - 5,MacOS,Chrome,VS Code,Vite,"JavaScript, C#","Canvas, WebGL, WebGPU, WebXR, PWA Installs, Web Animations, Web Audio, WebSocket, Local Storage, WebAssembly","Three.js, Unity",,Git,Puzzle,"Online forums and communities, Blogs and articles, I don't","I create them on my own, I buy assets or packs via Internet / product (eg. Adobe Stock, Unity etc.), I use free (eg. CC, Unsplash, Getty Images etc.) resources on the Internet","Adobe Photoshop, Krita, Adobe Animate",I buy assets or packs via Internet (eg. Envato),Audition,Myself,When the game is totally finished,I don’t find an audience to test my games,"On our own website, Through publishers","X (formerly Twitter), Bluesky, Facebook, YouTube, GitHub, Discord","Salary (related to game development), Licensing fees (fixed / subscription / revenue share), Direct sales (paid games)",Salary (related to game development),6,$51k - 100k,Neutral,No,No,8,,,
Japan,Norway,26 - 35,Male,Hobbyist,solo,3 - 5,1,6 - 10,MacOS,Chrome,VS Code,"Vite, TypeScript, NPM","JavaScript, TypeScript","Canvas, WebGL, Web Monetization","Phaser, My own / in-house",Angular,Git,"Platform, Puzzle, Casual","Online forums and communities, Blogs and articles, Social media, Newsletters and mailing lists","I create them on my own, I buy assets or packs via Internet / product (eg. Adobe Stock, Unity etc.)","Affinity Photo, Affinity Designer","I create them on my own, I buy assets or packs via Internet (eg. Envato)",Ableton Live,"Myself, Community, Friends and family",First prototype,"Via my community / my fanbase, Friends and family","On our own website, Through publishers","X (formerly Twitter), Bluesky, Discord, Reddit",Salary (unrelated to game development),Salary (unrelated to game development),0,< $1k,In favor,"Near, Polygon, Avalanche","Does tedious work for me (simple tasks that can be created with a prompt), making me create games faster",5,Getting enough time to work on the game enough to make it great,"Getting a good source of income. I've tried online publishers (Poki, Crazy Games, Addicting Games, Playhop), web3 publishers (Arcadia, Centarius), but there isn't much revenue from all those combined. ",
United States,Spain,36 - 45,Male,Hobbyist,solo,< 1,11 - 20,21 - 50,Windows,Chrome,Godot,None,Gdscript ,Not applicable,Godot,None,Git,"Adventure, Action, Platform, Simulation, Fighting, Puzzle, Casual, Strategy",Online forums and communities,"I buy assets or packs via Internet / product (eg. Adobe Stock, Unity etc.), I use free (eg. CC, Unsplash, Getty Images etc.) resources on the Internet","GIMP, Aseprite","I have a music producer in my team, I use free (eg. CC) resources on the Internet",Audacity,"Myself, We don't have tests",Some other stage in development,"I publish my test versions publicly, Game development meeting groups and meetups",Itch.io and similar,"YouTube, GitHub, Discord",Salary (unrelated to game development),Salary (unrelated to game development),0,< $1k,Strongly against,,,9,,,
Germany,Germany,46 - 55,Male,Hobbyist,Not applicable,6 - 10,1,0,Linux,Vivaldi,VS Code,Vite,"JavaScript, TypeScript, Lua",Not applicable,"Godot, Kaplay",Svelte,Git,"Adventure, RPG, Roguelike","Online forums and communities, Blogs and articles, Social media","I create them on my own, I buy assets or packs via Internet / product (eg. Adobe Stock, Unity etc.), I use free (eg. CC, Unsplash, Getty Images etc.) resources on the Internet, Procedural generation","GIMP, Inkscape, Blender, Pixelorama, Penpot","I buy assets or packs via Internet (eg. Envato), I use free (eg. CC) resources on the Internet",,"Myself, Community",Some other stage in development,"I publish my test versions publicly, Discord / Twitter / other socials, Forums",Itch.io and similar,"Mastodon, YouTube",Salary (unrelated to game development),Salary (unrelated to game development),0,0,Strongly against,,Not at all.,7,,,
United States,United States,< 18,Male,Hobbyist,Not applicable,3 - 5,11 - 20,1,Windows,Chrome,VS Code,NPM,"JavaScript, Lua","Canvas, Web Animations, Web Audio, WebSocket, Local Storage","Cocos, Currently creating and using a custom one developed by another person and I",React,Git,"Platform, Puzzle, Casual, Rhythm","Online forums and communities, Social media","I create them on my own, Procedural generation","Adobe Photoshop, Figma","I create them on my own, I use free (eg. CC) resources on the Internet","Audacity, Usually FL Studio","Myself, Friends and family",First prototype,Friends and family,"On our own website, Itch.io and similar","X (formerly Twitter), TikTok, YouTube, Discord",Donations,Donations,10,< $1k,Against,,"It's helped when I'm stuck on a problem, and I can't find any understandable solutions online.",8,"When I start on a project, it's fun at first. But sometimes I start wo work on something else, and that previous project now seems more like an unfinished project making it not nearly as fun as before.","CSS seems very unorganized, and there's no alternatives or a better version of it from what I have seen. People also seem to think your code is a ""waste of time"" if something similar exists already on NPM.",
Jamaica,United States,26 - 35,Male,Hobbyist,solo,< 1,0,0,Windows,Brave,Notepad++,None,JavaScript,WebGPU,"Phaser, Pixi.js",None,Git,"RPG, Fighting, Roguelike","Online forums and communities, Blogs and articles, Social media, Online courses and tutorials, Newsletters and mailing lists","I create them on my own, I use free (eg. CC, Unsplash, Getty Images etc.) resources on the Internet, AI tools","GIMP, Inkscape, Blender","I use free (eg. CC) resources on the Internet, AI tools",,"Myself, Friends and family",When the game is totally finished,I don’t find an audience to test my games,Nothing published yet,None,"Crypto / NFTs, Computer Technician",Computer Technician,0,0,In favor,I'm interested in the dojoengine,I use it for everything from learn code to art prototyping and in game sounds,8,Not really just the grind of building projects,Too new to game dev to provide any insight here,"Keep up the good work with the the newsletter, it really helps with keeping up with my hobby"
United States,United States,36 - 45,Male,Hobbyist,Not applicable,3 - 5,11 - 20,11 - 20,Windows,Brave,Sublime Text,"Webpack, Rollup, TypeScript, NPM","JavaScript, TypeScript, Java, Python, GDscript",Local Storage,"Phaser, Godot, Defold, GameMaker, LittleJS",None,Git,"Adventure, Action, Platform, RPG, Strategy, Stealth","Online forums and communities, Blogs and articles, Newsletters and mailing lists","I have a designer in my team, I buy assets or packs via Internet / product (eg. Adobe Stock, Unity etc.), I use free (eg. CC, Unsplash, Getty Images etc.) resources on the Internet",,"I create them on my own, I have a music producer in my team, I use free (eg. CC) resources on the Internet","Audacity, Reaper","Myself, Friends and family",First prototype,"Via my community / my fanbase, Friends and family, Discord / Twitter / other socials",Itch.io and similar,"X (formerly Twitter), Discord",Salary (unrelated to game development),Salary (unrelated to game development),0,0,Neutral,,,8,"Since I'm a hobbyist with full time job, family, etc there is just not enough time to learn as much as I want and create as much as I want in gamedev. I don't think the tools and community and opportunity have ever been better though, especially for indie devs and studios. ",I get the feeling that there isnt a lot of money specifically in the web game dev community. It is more for passion and possibly non primary income. That may change direction but not as many people take web game dev as serious as regular game dev but the tools and capabilities are growing quickly. ,I think that this site and community and jam are some of the best I've come along and I don't even normally focus or target web games but between gamedev.js and now js13k this community and all are amazing. I don't think all this would be near what it is without Andrzej either. I'm not quite sure how he does all that he does
United States,United States,26 - 35,Male,Freelancer,solo,6 - 10,50+,50+,Windows,Firefox,VSCodium,"Vite, Webpack, Next.js, TypeScript, NPM","JavaScript, TypeScript, C#, Lua","Canvas, WebGL, WebXR, Local Storage, WebAssembly","Three.js, Phaser, Godot, LittleJS",None,Git,"Action, Platform, Simulation, Puzzle, Casual, Party, Roguelike","Online forums and communities, Blogs and articles","I create them on my own, I buy assets or packs via Internet / product (eg. Adobe Stock, Unity etc.), I use free (eg. CC, Unsplash, Getty Images etc.) resources on the Internet, Procedural generation, AI tools","Krita, Aseprite","I create them on my own, I buy assets or packs via Internet (eg. Envato), I use free (eg. CC) resources on the Internet, Procedural generation","Audacity, Bfxr, LMMS","Myself, Friends and family",First prototype,"I publish my test versions publicly, Discord / Twitter / other socials, Forums",Itch.io and similar,"X (formerly Twitter), Discord","Salary (related to game development), Salary (unrelated to game development), Client work",Client work,2,< $1k,Strongly in favor,"Stacks, NEAR Protocol",Workflows for coding and making assets have become faster and more efficient.,8,"Funding, marketing",Having a sustainable income or financial support to continue making games.,Thanks for doing these surveys!
United States,France,46 - 55,Male,Self-employed,2 - 5,6 - 10,50+,21 - 50,MacOS,Chrome,VS Code,"Browserify, TypeScript, NPM, My own","JavaScript, TypeScript","Canvas, WebGL, WebSocket, Local Storage, WebAssembly, Speech Synthesis","Phaser, Godot, LittleJS, My own / in-house",React,Git,"Adventure, Action, Sports, Platform, Simulation, RPG, Puzzle, Casual, Strategy, Roguelike","Online forums and communities, Blogs and articles, Social media",I create them on my own,Aseprite,I create them on my own,"Bfxr, GarageBand, ZZfx, Beepbox",Myself,When the game is totally finished,"Friends and family, Game development meeting groups and meetups, Discord / Twitter / other socials, Forums","On our own website, Itch.io and similar, Steam, Newgrounds","X (formerly Twitter), Bluesky, Facebook, YouTube, Discord, Reddit",None,None,0,< $1k,Neutral,,It helped with coding,7,"Complete a polished product, marketing",Adapt to use of AI,
Austria,Austria,46 - 55,Male,Hobbyist,solo,6 - 10,6 - 10,6 - 10,Windows,Chrome,VS Code,"Gulp, NPM",JavaScript,"Canvas, WebGL, Web Audio, Local Storage","Three.js, Kontra, A-Frame, My own / in-house, None",knockout.js,Git,"Action, Platform, Racing, Shooter","Online forums and communities, Blogs and articles","I create them on my own, I use free (eg. CC, Unsplash, Getty Images etc.) resources on the Internet, Procedural generation","Affinity Photo, Affinity Designer","I create them on my own, I use free (eg. CC) resources on the Internet",soundbox (sb.bitsnbites.eu),"Myself, Friends and family",Some other stage in development,"Friends and family, Discord / Twitter / other socials",Itch.io and similar,"Facebook, Instagram, Discord",Salary (unrelated to game development),Salary (unrelated to game development),0,0,Neutral,,not yet,9,,,
France,France,26 - 35,Male,Hobbyist,Not applicable,3 - 5,2 - 5,2 - 5,Windows,Chrome,VS Code,Rollup,"JavaScript, TypeScript","Canvas, Web Animations, Web Audio, Local Storage, History","My own / in-house, None",React,Git,"Puzzle, Roguelike","Blogs and articles, Social media","I create them on my own, I use free (eg. CC, Unsplash, Getty Images etc.) resources on the Internet, AI tools","GIMP, Paint","I use free (eg. CC) resources on the Internet, AI tools",,"Myself, Friends and family",Concept phase,Friends and family,"On our own website, Itch.io and similar, GitHub page","X (formerly Twitter), Bluesky",Salary (unrelated to game development),Salary (unrelated to game development),0,0,Against,,,7,Publishing them on stores is really NOT easy,"Packaging a web game into a bundle runnable on multiple devices (Android, iOS, Windows Phone etc) is still challenging. We're in 2024 and solutions like Cordova are still not that easy to use!",
United Kingdom,United Kingdom,< 18,Male,Self-employed,solo,6 - 10,6 - 10,2 - 5,Windows,Firefox,VS Code,,JavaScript,"Canvas, Web Audio, Local Storage",None,None,Git,"Adventure, Action, Platform, Strategy, Survival, Roguelike","Blogs and articles, Newsletters and mailing lists, I don't","I create them on my own, Procedural generation","Microsoft Paint 3D (ikr, so bad)","I create them on my own, Procedural generation",ZZFX by frank force,"Myself, Friends and family",When the game is totally finished,I don’t find an audience to test my games,On our own website,"X (formerly Twitter), YouTube, None",None,None,0,0,Neutral,,"Nothing at the moment, but it's kinda annoying that people actually LIKE the junk AI is making",9,It gets very boring and you have to drag yourself through some parts,Hm... Climate Change? Idk! xd,https://joachimford.uk ;)
